Product_ID,product,price_dollars,ratings,reviews_qty,url,category,Customer_1_ID,Customer_1_Star_Rating,Customer_1_Comment,Customer_1_buying_influence,Customer_2_ID,Customer_2_Star_Rating,Customer_2_Comment,Customer_2_buying_influence,Customer_3_ID,Customer_3_Star_Rating,Customer_3_Comment,Customer_3_buying_influence,Customer_4_ID,Customer_4_Star_Rating,Customer_4_Comment,Customer_4_buying_influence,Customer_5_ID,Customer_5_Star_Rating,Customer_5_Comment,Customer_5_buying_influence
B0BZ9XNBRB,Google Pixel 7a - Unlocked Android Cell Phone - Smartphone with Wide Angle Lens and 24-Hour Battery - 128 GB – Charcoal,499.00,4.2,531,https://www.amazon.com/product-reviews/B0BZ9XNBRB/ref=cm_cr_dp_d_show_all_top?ie=UTF8&reviewerType=all_reviews,Smartphones,R1B3EGMQP3U9HM,5.0,"5.0 out of 5 stars
Pixel 7a: Unleashes the Pixel Magic at an Affordable Price",36.0,ROSGYBSL94XZ5,4.0,"4.0 out of 5 stars
Poor man's iPhone",5.0,R2GJ7L8RJJR7FV,4.0,"4.0 out of 5 stars
Great overall, especially call screening, though a couple unexpected issues",9.0,R1ARDK7GYTSU3X,4.0,"4.0 out of 5 stars
Surprisingly nice phone.",7.0,R2M2XB8HL58NXX,2.0,"2.0 out of 5 stars
Horrific battery life, be cautious before you buy",80.0
B09PFC2DVD,Motorola Moto G Stylus | 2022 | 2-Day battery | Unlocked| Made for US by Motorola | 6/128GB | 50MP Camera | Twilight Blue,160.00,4.2,1899,https://www.amazon.com/product-reviews/B09PFC2DVD/ref=cm_cr_dp_d_show_all_top?ie=UTF8&reviewerType=all_reviews,Smartphones,R19243VDW0AHU2,4.0,"4.0 out of 5 stars
Overall good phone, fast hardware. Mediocre moto software",9.0,R2DJOPYCSL057X,4.0,"4.0 out of 5 stars
Under $200, 6GB RAM, 128GB storage, low bloat phone - I like it",36.0,RYQ2SN2XM2W94,4.0,"4.0 out of 5 stars
Better than Samsung",1.0,R2HAIUG5UTXWTO,4.0,"4.0 out of 5 stars
Pretty good phone for the price",0.0,R3RYORNK18RFX1,4.0,"4.0 out of 5 stars
Very good phone for the price",2.0
B0C22BRGLG,"OnePlus Nord N30 5G | Unlocked Dual-SIM Android Smart Phone | 6.7"" LCD Display | 8 +128GB | 5000 mAh Battery | 50W Fast Charging | 108MP Camera | Chromatic Gray",269.99,4.4,130,https://www.amazon.com/product-reviews/B0C22BRGLG/ref=cm_cr_dp_d_show_all_top?ie=UTF8&reviewerType=all_reviews,Smartphones,RXSAKESHAF4LZ,4.0,"4.0 out of 5 stars
Nice phone",5.0,R2RXLF1QON95XI,4.0,"4.0 out of 5 stars
Bang for the buck, with some quirks",73.0,R4KZK9VF1TPJC,5.0,"5.0 out of 5 stars
Exactly what I was wanting",12.0,R1FCK48ND2XZL9,5.0,"5.0 out of 5 stars
Jumped at this offer - enjoying it",53.0,RTIFBUVJPXUZ0,4.0,"4.0 out of 5 stars
Great phone",4.0
B0BCQXXRJJ,Google Pixel 7-5G Android Phone - Unlocked Smartphone with Wide Angle Lens and 24-Hour Battery - 128GB - Obsidian,497.99,4.3,3065,https://www.amazon.com/product-reviews/B0BCQXXRJJ/ref=cm_cr_dp_d_show_all_top?ie=UTF8&reviewerType=all_reviews,Smartphones,RE4ER1P5QMX1S,4.0,"4.0 out of 5 stars
Pixel Phones are Still King but Mine Had Flaws",9.0,R33OZ0QVN7YS8Q,4.0,"4.0 out of 5 stars
Better Value than a Galaxy S23",96.0,R506S9F5UZDED,5.0,"5.0 out of 5 stars
Great phone and cheap price!!!",0.0,R1OH3858AUS7SZ,3.0,"3.0 out of 5 stars
Amazon is excellent, Google customer service not so much.",106.0,R320SNFHDWHBCB,4.0,"4.0 out of 5 stars
Google Pixel 7 was a touch less than the Pixel 7 Pro",3.0
B0BSLRXF1H,"SAMSUNG Galaxy A54 5G A Series Cell Phone, Factory Unlocked Android Smartphone, 128GB w/ 6.4” Fluid Display Screen, Hi Res Camera, Long Battery Life, Refined Design, US Version, 2023, Awesome Violet",349.99,4.4,187,https://www.amazon.com/product-reviews/B0BSLRXF1H/ref=cm_cr_dp_d_show_all_top?ie=UTF8&reviewerType=all_reviews,Smartphones,R3IE0NDNZZXBN9,5.0,"5.0 out of 5 stars
Good phone",5.0,R1DCCD4MQU12LM,5.0,"5.0 out of 5 stars
Great Battery Life and Customization",18.0,R36WW3GRJEAPZ8,4.0,"4.0 out of 5 stars
Long battery life",21.0,R3FST3BF4RXVRE,5.0,"5.0 out of 5 stars
Perfect",2.0,R2OJ9WHPMX469I,4.0,"4.0 out of 5 stars
If You Get SIM 1 Not allowed",6.0
B09TZ5ZBJT,Moto G 5G | 2022 | 2-Day Battery | Unlocked | Made for US by Motorola | 6/256GB | 50 MP Camera | Moonlight Gray,189.99,4.3,929,https://www.amazon.com/product-reviews/B09TZ5ZBJT/ref=cm_cr_dp_d_show_all_top?ie=UTF8&reviewerType=all_reviews,Smartphones,R2G4O3PKY9GC1D,5.0,"5.0 out of 5 stars
Great buy for the price",6.0,R1L3H9FKEKR12Q,4.0,"4.0 out of 5 stars
Good Phone but...",18.0,R1IPCTL6XNIT2B,5.0,"5.0 out of 5 stars
I surprised my husband with this replacement phone",19.0,RMPOL8QEJ0P0L,4.0,"4.0 out of 5 stars
Motorola phones are getting more and more complicated and full of bloatware",15.0,RFMFGYRMIPDR7,4.0,"4.0 out of 5 stars
Great upgrade from Moto G Power (2021)",4.0
B08FRTH1KJ,Samsung Galaxy S20+ 5G 128GB Fully Unlocked Smartphone (Renewed),239.00,4.3,4048,https://www.amazon.com/product-reviews/B08FRTH1KJ/ref=cm_cr_dp_d_show_all_top?ie=UTF8&reviewerType=all_reviews,Smartphones,R1MCZL317DUBYM,4.0,"4.0 out of 5 stars
Great buy - but it freezes",3.0,R2U4VDW1RHKYD6,4.0,"4.0 out of 5 stars
Good phone so far",0.0,R2FO7YWH2V58BR,5.0,"5.0 out of 5 stars
The Best Option for Me",0.0,R2V38O898L1BM8,5.0,"5.0 out of 5 stars
Ahora voy a comprar usados desde Amazon",0.0,R9HWPJ38DZUDN,5.0,"5.0 out of 5 stars
Our old phone was incompatible with our new provider",0.0
B0B3PSRHHN,Google Pixel 6a - 5G Android Phone - Unlocked Smartphone with 12 Megapixel Camera and 24-Hour Battery - Charcoal,309.99,4.3,5209,https://www.amazon.com/product-reviews/B0B3PSRHHN/ref=cm_cr_dp_d_show_all_top?ie=UTF8&reviewerType=all_reviews,Smartphones,R36GQP2LHY1DIG,4.0,"4.0 out of 5 stars
The best all-around phone at this price point (in the US, at least)",189.0,R3AAKHR07NTT1B,5.0,"5.0 out of 5 stars
More than meets my needs",24.0,R4KHL0ERH66X7,4.0,"4.0 out of 5 stars
Solid phone so far and I'm very pleased with it",1.0,R1EJ4Q5CVD6V2Z,4.0,"4.0 out of 5 stars
Moving on from Moto G line, great alternative",47.0,R1PGRIMWSJ1IZC,5.0,"5.0 out of 5 stars
My First Big Boy Phone",0.0
B0BBXBXCFC,"Total by Verizon TCL 30 Z, 32GB, Black - Prepaid Smartphone (Locked)",29.88,4.0,220,https://www.amazon.com/product-reviews/B0BBXBXCFC/ref=cm_cr_dp_d_show_all_top?ie=UTF8&reviewerType=all_reviews,Smartphones,R152O8QX1OH8JF,3.0,"3.0 out of 5 stars
good budget phone for kids, but with some drawbacks",8.0,R2S94ZO3ACPHE8,3.0,"3.0 out of 5 stars
So you dropped your flagship into the dr(s)ink",6.0,RXK3NLF8FAO2B,4.0,"4.0 out of 5 stars
I'll be darned, shocked and amazed!",30.0,R4PJE32AYMY6R,5.0,"5.0 out of 5 stars
Great cheap phone!",8.0,R2OBDAFOOFY67R,4.0,"4.0 out of 5 stars
Nice for the Price",16.0
B0C9R4LPMW,"xixaomiro i14Pro Max Unlocked 5G Cellphone Android Smartphone Mobile Phone, 8GB RAM, 512GB ROM 1TB Expandable, 6.8'' FHD Screen, 6000mAh Battery, Dual Sim Card, 48+13MP Camera (Golden)",129.00,3.6,20,https://www.amazon.com/product-reviews/B0C9R4LPMW/ref=cm_cr_dp_d_show_all_top?ie=UTF8&reviewerType=all_reviews,Smartphones,R2TAUDT8CC66S2,4.0,"4.0 out of 5 stars
Excellent phone but Can't Use 8x8 Work",3.0,R10L0SKUZKLHY1,4.0,"4.0 out of 5 stars
Can I get warranty for this phone",2.0,RERFUWUOPMFXV,5.0,"5.0 out of 5 stars
It is suprisingly heavy",0.0,RTZXWNY0VFHG5,5.0,"5.0 out of 5 stars
Gamer grandson likes it",1.0,R1ML3P86EROJKC,2.0,"2.0 out of 5 stars
Piece of Trash Scam",2.0
B09QKRDZ4N,Kase Star Burst Filter for Phone 50mm Magnetic Square Starburst Filter for iPhone x xr xs 11 12 13 14 Pro Max and Android Smartphone,18.17,3.3,37,https://www.amazon.com/product-reviews/B09QKRDZ4N/ref=cm_cr_dp_d_show_all_top?ie=UTF8&reviewerType=all_reviews,Smartphones,R2F2L2I0RUY505,3.0,"3.0 out of 5 stars
Kills wireless charging",6.0,RN44D0PCT3F8C,4.0,"4.0 out of 5 stars
Not compatible with 14 Pro Max",2.0,RSE5L5BP9WXOY,2.0,"2.0 out of 5 stars
The magnetic stickers didn’t work",1.0,R2J6S6PSXYI7P1,4.0,"4.0 out of 5 stars
What they need is a Kase case…",7.0,RIS2LII7NUFGD,1.0,"1.0 out of 5 stars
NOT Compatible with iPhone 14 Pro - Good Idea, Bad Execution",3.0
B0C2VZ9GRR,Xiaomi Redmi Note 12s (256GB + 8GB) Global Unlocked (No Warranty) (Tmobile/Metro Tello/Mint USA Market) (w/Fast Car Charger Bundle) (Ice Blue),195.50,4.7,2885,https://www.amazon.com/product-reviews/B0C2VZ9GRR/ref=cm_cr_dp_d_show_all_top?ie=UTF8&reviewerType=all_reviews,Smartphones,RQ57JKVHQVQ30,5.0,"5.0 out of 5 stars
Excelente",0.0,R2OAHJS60D6ATI,4.0,"4.0 out of 5 stars
Buen Rendimiento",1.0,R2H6079I06LUSH,2.0,"2.0 out of 5 stars
no llego todo lo ofrecido me falto el cargador de coche rapido",2.0,R10VLZY0OZ6K1W,1.0,"1.0 out of 5 stars
Right hand side of the screen runs up and down constantly",0.0,R20WN11QZUZOMG,0.0,A54 vs 12s - minha opinião usando os dois,287.0
B0BLW47H3M,"SAMSUNG Galaxy A14 5G A Series Cell Phone, Factory Unlocked Android Smartphone, 64GB w/Expandable Storage, Long Battery Life, 13MP Camera, 6.6"" Infinite Display Screen, US Version, 2023, Black",199.99,4.2,467,https://www.amazon.com/product-reviews/B0BLW47H3M/ref=cm_cr_dp_d_show_all_top?ie=UTF8&reviewerType=all_reviews,Smartphones,R2T0ILYGONUKK8,5.0,"5.0 out of 5 stars
I love it!",0.0,R18F4UZ1UCM1TJ,5.0,"5.0 out of 5 stars
I will only buy a Samsung phone",26.0,R223K8RTHFX06V,5.0,"5.0 out of 5 stars
Great Samsung Design",11.0,R15MJ8TY7E1X49,4.0,"4.0 out of 5 stars
Love the phone!",18.0,R33T7FN8H31DA8,5.0,"5.0 out of 5 stars
Great phone for the price.  Perfect for kids or older people.",2.0
B09T2JFWKR,"Tracfone Samsung Galaxy A03s, 32GB, Black - Prepaid Smartphone (Locked)",49.88,4.2,1128,https://www.amazon.com/product-reviews/B09T2JFWKR/ref=cm_cr_dp_d_show_all_top?ie=UTF8&reviewerType=all_reviews,Smartphones,R253XLOQ5HISY6,4.0,"4.0 out of 5 stars
Large phone. Poor customer support from tracfone",13.0,R3FQYFMGZTLMR3,5.0,"5.0 out of 5 stars
Great buy for the price",2.0,R3VXBJCB96OH0N,4.0,"4.0 out of 5 stars
A little bit of pain in the ##to set up kept saying no mobile network available",2.0,RV131M92YLSYA,4.0,"4.0 out of 5 stars
great phone for the money",4.0,R3P37JJV6A9PNG,4.0,"4.0 out of 5 stars
Went thru 2 of these phones in 4mos",10.0
B0BNWPSCGB,OnePlus 11 5G | 16GB RAM+256GB | Dual-SIM | Titan Black | US Factory Unlocked Android Smartphone | 5000 mAh battery | 80W Fast charging | Hasselblad Camera | 120Hz Fluid Display | 4nm Processor,649.99,4.4,723,https://www.amazon.com/product-reviews/B0BNWPSCGB/ref=cm_cr_dp_d_show_all_top?ie=UTF8&reviewerType=all_reviews,Smartphones,R17XJDSOSJHPNC,4.0,"4.0 out of 5 stars
Good Overall",13.0,R37MGE5YGLEN2N,5.0,"5.0 out of 5 stars
its good for what i wanted especially  camera, and battery life.",19.0,R10KU6MS0C0XCC,4.0,"4.0 out of 5 stars
It's not a S23 ultra but it's a good phone",28.0,R2VC2V6ALCPT4X,5.0,"5.0 out of 5 stars
Love it!",41.0,R3D1IWHWXHK8CO,4.0,"4.0 out of 5 stars
Teléfono",6.0
B0BCG1MD2Q,"UMIDIGI Cell Phone G1 MAX, Android12 Unlocked Smartphone, Dual Sim 4G LTE Mobile Phone, 128GB/256G Expandable, 6.52"" HD+ Night Mode，5150mAh, GSM Unlocked Phone",109.99,4.0,363,https://www.amazon.com/product-reviews/B0BCG1MD2Q/ref=cm_cr_dp_d_show_all_top?ie=UTF8&reviewerType=all_reviews,Smartphones,R2RHWRA4J23DMT,5.0,"5.0 out of 5 stars
Fantastic Budget Option Android That Punches Above It's Weight Class With Features",7.0,R13HLAMKGVMSPI,5.0,"5.0 out of 5 stars
Really great phone. Buy it!",7.0,RG4PINE9HNYBH,4.0,"4.0 out of 5 stars
Unexpectedly good, but with one problem: e-SIM",7.0,RRDEPB1XV9OLM,4.0,"4.0 out of 5 stars
The Umidigi G1 Max is a Great Value Smartphone with Exceptional Features!",16.0,R3KDM6LHGWP8EC,3.0,"3.0 out of 5 stars
DOES NOT WORK WITH VERIZON, PERIOD!!!!!! See edit",6.0
B0C996PJ7K,"UMIDIGI G5 Mecha Rugged Unlocked Smartphones, 8GB+128GB Waterproof IP68/IP69K Android 13 Unisoc T606 50MP+2MP+8MP Camera 6.6"" FHD 6000mAh Fast Charge Cell Phone",189.99,5.0,1,https://www.amazon.com/product-reviews/B0C996PJ7K/ref=cm_cr_dp_d_show_all_top?ie=UTF8&reviewerType=all_reviews,Smartphones,R2IPABJV7HZ4TK,5.0,"5.0 out of 5 stars
Really nice low-cost phone",0.0,None,0.0,No Comment,0.0,None,0.0,No Comment,0.0,None,0.0,No Comment,0.0,None,0.0,No Comment,0.0
B0C9J2287C,"TCL 40 X 5G Unlocked Phone, 6.56 Inch HD+ Display Smartphone, 5000 mAh Cell Phone, 50MP Main Camera, Android 13, 4GB + 64GB Mobile Phone, U.S. Version, Starlight Black",199.99,4.4,17,https://www.amazon.com/product-reviews/B0C9J2287C/ref=cm_cr_dp_d_show_all_top?ie=UTF8&reviewerType=all_reviews,Smartphones,R16PV8SCOYWG9M,4.0,"4.0 out of 5 stars
After plenty of searching, I've found a diamond in the rough.",4.0,R30I5EFOIH49B6,5.0,"5.0 out of 5 stars
Budget-Friendly Phone with close to flagship features.",17.0,R2Z2VJ0RHVYYI5,5.0,"5.0 out of 5 stars
For the prices this is hard to beat",10.0,R3L4OF9QSWL2PM,5.0,"5.0 out of 5 stars
Reordered phone",1.0,R2R5R65UIICIRE,5.0,"5.0 out of 5 stars
Love the fingerprint reader",1.0
B0C1RKNF5B,"TCL ION V |2023| Cell Phone with 6.0"" HD+ Display, 3+32GB Unlocked Phone, 3000mAh Battery, Android 13 Smartphone, Single SIM, US Version, Space Black",99.99,4.2,2600,https://www.amazon.com/product-reviews/B0C1RKNF5B/ref=cm_cr_dp_d_show_all_top?ie=UTF8&reviewerType=all_reviews,Smartphones,R1KFHCXLHUOJ2W,4.0,"4.0 out of 5 stars
This is a T430M according to the specs right on the phone itself.",1.0,R1KGLUTFM4Q86K,4.0,"4.0 out of 5 stars
Good Phone-But if your are on ATT there is something you might need to know.",27.0,R3AB86Z1KXMGQ6,5.0,"5.0 out of 5 stars
Good phone and a great price!",1.0,R1TWONT29P3F63,5.0,"5.0 out of 5 stars
Great size phone, quite functional for the money",1.0,R25LXE04PLPGZC,5.0,"5.0 out of 5 stars
Impressive bang-for-buck",4.0
B0B1ZS5HQ9,"UMIDIGI F3 (8GB+128GB) Unlocked Cell Phone, NFC, Android11, 6.7inch HD Full Screen, 5150mAh Battery, Smartphone with Sony 48MP AI Triple Camera, 18W Fast Charging, Dual SIM",148.99,3.9,858,https://www.amazon.com/product-reviews/B0B1ZS5HQ9/ref=cm_cr_dp_d_show_all_top?ie=UTF8&reviewerType=all_reviews,Smartphones,R3K1KEMULQPQED,3.0,"3.0 out of 5 stars
Just think of the price",7.0,R3TVGGD2Z4ZRV2,5.0,"5.0 out of 5 stars
Decent Budget Phone",6.0,R274APULTF7PLI,5.0,"5.0 out of 5 stars
Perfect Mid-Range Phone for the Price!",17.0,R1E9UBDT69DO4C,4.0,"4.0 out of 5 stars
Does not work with Straight Talk Wireless Verizon Sims",11.0,R2NWN4H739IAS2,5.0,"5.0 out of 5 stars
Great phone - Low price!",0.0
B09PN61VR9,"ULCLAYRUS Portable 60"" Aluminum Alloy Selfie Stick Tripod Stand with Remote,Compact Size, Phone Tripod for 4''-7'' iPhone and Android Smartphones Black+Red",29.99,4.6,1017,https://www.amazon.com/product-reviews/B09PN61VR9/ref=cm_cr_dp_d_show_all_top?ie=UTF8&reviewerType=all_reviews,Smartphones,R2QLWZMRXS7E75,5.0,"5.0 out of 5 stars
Favorite purchase for a selfie!",0.0,R3HKO623A79GWD,5.0,"5.0 out of 5 stars
Works Great - very useful",1.0,R2LD8865GJTOSM,5.0,"5.0 out of 5 stars
Good Value",0.0,R20AOARZ9P4VTO,5.0,"5.0 out of 5 stars
Justo lo necesario, pero algo pesado",0.0,R3DND0NZNJ5WFX,5.0,"5.0 out of 5 stars
Very nice",1.0
B0BTP6PJ9J,"TCL 40XL 2023 Unlocked Cell Phone 4GB + 128GB, 6.75"" 90Hz Display, Smartphone Android 13, 50MP AI Camera Mobile Phone, 5000 mAh, 4G LTE, US Version, Dark Gray",139.99,4.0,283,https://www.amazon.com/product-reviews/B0BTP6PJ9J/ref=cm_cr_dp_d_show_all_top?ie=UTF8&reviewerType=all_reviews,Smartphones,RH8CM5SG9V9A6,4.0,"4.0 out of 5 stars
Good and Bad things About TCL 40",17.0,R3ORZQBDHLRFQS,4.0,"4.0 out of 5 stars
I like it. Easiest set up of any of the numerous phones I've had.",0.0,R245MSQZGIDITN,5.0,"5.0 out of 5 stars
Perfect purchase",1.0,R2IKBW8VTKT6GN,4.0,"4.0 out of 5 stars
Good phone not great",0.0,RLSHXAUBQIGSQ,5.0,"5.0 out of 5 stars
Great cell phone",13.0
B0BLP3ZZXT,"SAMSUNG Galaxy S23 Ultra Cell Phone, Factory Unlocked Android Smartphone, 256GB, 200MP Camera, Night Mode, Long Battery Life, S Pen, US Version, 2023, Green",999.99,4.6,381,https://www.amazon.com/product-reviews/B0BLP3ZZXT/ref=cm_cr_dp_d_show_all_top?ie=UTF8&reviewerType=all_reviews,Smartphones,R2AQCDYZDMH01F,5.0,"5.0 out of 5 stars
Most beautiful phone I've ever used",8.0,R15FYNDZVZBGTZ,5.0,"5.0 out of 5 stars
Best phone made today",2.0,RCV9M9H26BVXA,5.0,"5.0 out of 5 stars
Best smartphone ever",0.0,R1OY3C5CMLQRVL,5.0,"5.0 out of 5 stars
Great value",1.0,R2AWM003X1HLWQ,4.0,"4.0 out of 5 stars
Attitude of the UPS pickup driver.",4.0
B09S8BV4D9,OnePlus 10 Pro | 5G Android Smartphone | 8GB+128GB | U.S. Unlocked | Triple Camera co-Developed with Hasselblad | Volcanic Black,448.18,4.3,363,https://www.amazon.com/product-reviews/B09S8BV4D9/ref=cm_cr_dp_d_show_all_top?ie=UTF8&reviewerType=all_reviews,Smartphones,R1XO2E5J38DJTH,4.0,"4.0 out of 5 stars
Better than Almost Every Flagship Phone",2.0,R134980WQ80Q3V,5.0,"5.0 out of 5 stars
Reason for Returning",5.0,R2T9KFHQQ7AU7I,5.0,"5.0 out of 5 stars
OnePlus for the win!",0.0,R1QG24Q6Y83O3,5.0,"5.0 out of 5 stars
Fantastic Phone!!",2.0,R2IHCNPAN12RD,4.0,"4.0 out of 5 stars
Muy fluido y bonito",1.0
B0C2T3CDGJ,Nokia C21 Plus | Android 11 (Go Edition) | Unlocked Smartphone | 2-Day Battery | Dual SIM | 2/64GB | 6.52-Inch Screen | Cyan,99.00,4.5,11,https://www.amazon.com/product-reviews/B0C2T3CDGJ/ref=cm_cr_dp_d_show_all_top?ie=UTF8&reviewerType=all_reviews,Smartphones,R1ZY9JFOP67Z8K,5.0,"5.0 out of 5 stars
Nokia c21 plus",5.0,R38JVCFY2WR0D2,1.0,"1.0 out of 5 stars
Don't buy this phone it's trash",1.0,None,0.0,No Comment,0.0,None,0.0,No Comment,0.0,None,0.0,No Comment,0.0
B0BVX8YJJ2,"Xiaomi Redmi 12C 4G LTE (128GB + 4GB) Factory Unlocked GSM 6.71"" 50MP Dual Camera (ONLY T-Mobile/Mint USA Market) + (w/Fast Car Charger Bundle) (Graphite Gray)",113.50,4.7,3454,https://www.amazon.com/product-reviews/B0BVX8YJJ2/ref=cm_cr_dp_d_show_all_top?ie=UTF8&reviewerType=all_reviews,Smartphones,RM5RLIFNM8NW4,5.0,"5.0 out of 5 stars
Ningún problema",0.0,R1SOJ99BF49OMR,4.0,"4.0 out of 5 stars
Good phone",0.0,R15MTV1QYHSG6P,5.0,"5.0 out of 5 stars
Buen producto",0.0,R10O8AC8D8Z984,5.0,"5.0 out of 5 stars
Todo en orden",0.0,R1AV0AUD7QPOA4,3.0,"3.0 out of 5 stars
Es un buen telefono",2.0
B0C7R7KX2T,"Ulefone Note 16 Pro Mobile Phones (16GB+256GB) Android 13 50MP Camera Octa Core Smartphone Unlocked 6.52” Waterdrop Screen, 4400mAh 4G Dual SIM Fingerprint Face ID GPS OTG, Globla Version- Black",139.99,4.1,37,https://www.amazon.com/product-reviews/B0C7R7KX2T/ref=cm_cr_dp_d_show_all_top?ie=UTF8&reviewerType=all_reviews,Smartphones,R3H4OZIFXHUFFD,5.0,"5.0 out of 5 stars
So far, so good!",6.0,R1UHE6WNNXC8P8,0.0,No Comment,0.0,R2UDNTEP12GOJM,0.0,No Comment,0.0,RMZ83ZNZD3040,0.0,No Comment,2.0,R2DMLK2JUWG8Q4,0.0,No Comment,0.0
B09Q9ZVXZY,"Xiaomi Redmi Note 11 - Smartphone 128GB, 4GB RAM, Dual Sim, Star Blue",159.99,4.4,18324,https://www.amazon.com/product-reviews/B09Q9ZVXZY/ref=cm_cr_dp_d_show_all_top?ie=UTF8&reviewerType=all_reviews,Smartphones,RXBK9188CX2XD,5.0,"5.0 out of 5 stars
nice phone",0.0,R3QJUC57UKBDOD,4.0,"4.0 out of 5 stars
Muy bueno",2.0,R18DFWP086VU7M,5.0,"5.0 out of 5 stars
Best phone",0.0,R31PHKMFMVIGEF,4.0,"4.0 out of 5 stars
Great cell phone",8.0,R12ASU4PQMC697,4.0,"4.0 out of 5 stars
buen producto",2.0
B09CBSS3BX,Nokia C01 Plus | Android 11 (Go Edition) | Unlocked Smartphone | 2-Day Battery | 1/32GB | 6.52-Inch Screen | Dark Blue,79.38,3.6,685,https://www.amazon.com/product-reviews/B09CBSS3BX/ref=cm_cr_dp_d_show_all_top?ie=UTF8&reviewerType=all_reviews,Smartphones,R23ARUQT1T6AWZ,4.0,"4.0 out of 5 stars
Quick service for needed item",0.0,R22LOJK6K1JTTR,4.0,"4.0 out of 5 stars
Hasta orita todo funciona bien",1.0,REQJQM4Y3R88B,3.0,"3.0 out of 5 stars
Not this one",0.0,RQAUW806NGMO6,5.0,"5.0 out of 5 stars
It's good for its purpose. Not for heavy and demanding apps. Keep it simple for this phone.",1.0,R1DAA7RYRPDL11,3.0,"3.0 out of 5 stars
You can do better",7.0
B09WZW47LP,"Xgody V40 Unlocked Cell Phones, 6.1 Inch 4G Smartphones, Android 10.0 OS with Free Dual SIM Quad Core, Dual 5MP Camera, 3000 mAh Battery, Face Unlocking (Black)",74.99,3.2,199,https://www.amazon.com/product-reviews/B09WZW47LP/ref=cm_cr_dp_d_show_all_top?ie=UTF8&reviewerType=all_reviews,Smartphones,R1DU7FQO5XTQ7X,3.0,"3.0 out of 5 stars
So so cheap quality",3.0,R2NQS4SH6IQZHA,4.0,"4.0 out of 5 stars
Battery power drains Rapidly????",2.0,R3M9QAF4HXXCH4,3.0,"3.0 out of 5 stars
Don’t know",1.0,RQA6OQM9O3KAW,2.0,"2.0 out of 5 stars
I had to return the phone.....",4.0,RFSJA7XNN8BRH,4.0,"4.0 out of 5 stars
Works Fine",1.0
B0BTP83RM6,"TCL 40XL 2023 Unlocked Cell Phone 6GB + 256GB, 6.75 inch 90Hz Display Mobile Phone, Smartphone Android 13, 50MP AI Camera, 5000 mAh, 4G LTE, US Version, Dark Gray",169.99,4.0,341,https://www.amazon.com/product-reviews/B0BTP83RM6/ref=cm_cr_dp_d_show_all_top?ie=UTF8&reviewerType=all_reviews,Smartphones,R1KUCVII5TJR9M,4.0,"4.0 out of 5 stars
Phone came and functioned as described",1.0,R346TZM8PYVKMZ,4.0,"4.0 out of 5 stars
Seems Like a Good Phone",6.0,R3FEI58Y377FQL,4.0,"4.0 out of 5 stars
TCL 40 XL has flagship potential!!!",33.0,R1Z5VGDM83FHZR,5.0,"5.0 out of 5 stars
Great first impressions!",4.0,R29IRU9KO2M3A0,3.0,"3.0 out of 5 stars
Not impressed",2.0
B0C7LNLS9P,"TracFone Moto g Pure (2021), 32GB, Blue - Prepaid Smartphone (Locked/Renewed)",24.99,4.1,21,https://www.amazon.com/product-reviews/B0C7LNLS9P/ref=cm_cr_dp_d_show_all_top?ie=UTF8&reviewerType=all_reviews,Smartphones,RT11E86JJWBQV,5.0,"5.0 out of 5 stars
Great Deal",0.0,R1O16RRLJZ6SFZ,5.0,"5.0 out of 5 stars
Very happy with this product",0.0,R2KSWLUU9VFOLQ,5.0,"5.0 out of 5 stars
Just like new!",0.0,R3V7Y7P8A3PQ8Z,5.0,"5.0 out of 5 stars
Works perfectly",1.0,R14H109WPL9HQ0,5.0,"5.0 out of 5 stars
Like brand new",1.0
B0C2S1DM2H,Motorola Moto G Stylus 5G | 2023 | Unlocked | Made for US 6/256GB | 50 MPCamera | Rose Champagne,299.99,4.2,25,https://www.amazon.com/product-reviews/B0C2S1DM2H/ref=cm_cr_dp_d_show_all_top?ie=UTF8&reviewerType=all_reviews,Smartphones,RDBSCQUTU68Y7,4.0,"4.0 out of 5 stars
Ugh",1.0,R37Q32G8U4UKDN,5.0,"5.0 out of 5 stars
Low-priced mid-range phone",33.0,R1L5W1C6UG8D0F,5.0,"5.0 out of 5 stars
Probably the best mid-range phone with a headphone jack",15.0,R1H8FG1W4LSEQH,5.0,"5.0 out of 5 stars
Love it.",3.0,R3BW5WTXVUOSAI,5.0,"5.0 out of 5 stars
Perfect phone",0.0
B0C5CJFVVD,"SAMSUNG Galaxy S20 FE 5G (128GB, 6GB) 6.5"" AMOLED, Snapdragon 865, Volte (Fully Unlocked for T-Mobile, AT&T, Verizon, Global) G781U1 (w/Wireless Charger, Navy) (Renewed)",220.08,3.6,25,https://www.amazon.com/product-reviews/B0C5CJFVVD/ref=cm_cr_dp_d_show_all_top?ie=UTF8&reviewerType=all_reviews,Smartphones,R3VU2B6KH53J5W,5.0,"5.0 out of 5 stars
Excelente",0.0,R1GKG4YY4AVKOG,2.0,"2.0 out of 5 stars
Junk",0.0,R2KQEMWAX4I982,5.0,"5.0 out of 5 stars
SUPER NICE phone.",0.0,R40AF0I6YX1ZN,5.0,"5.0 out of 5 stars
Better than expected",0.0,R37Q08UESVMAL6,5.0,"5.0 out of 5 stars
Perfect gift!",0.0
B0BQ118F2T,Moto G Play 2023 3-Day Battery Unlocked Made for US 3/32GB 16MP Camera Navy Blue,169.99,4.1,125,https://www.amazon.com/product-reviews/B0BQ118F2T/ref=cm_cr_dp_d_show_all_top?ie=UTF8&reviewerType=all_reviews,Smartphones,R22X23735G64S,4.0,"4.0 out of 5 stars
Not the worst but not the best.",12.0,R7DEQRNTBR25H,4.0,"4.0 out of 5 stars
good phone but is larger than you think.",0.0,R33ELWSVWL9TD0,4.0,"4.0 out of 5 stars
More good than bad. Don't be afraid",11.0,R2ANH6Y305DH0Z,4.0,"4.0 out of 5 stars
Phone came as described",0.0,R3CC51CJGG4FX2,3.0,"3.0 out of 5 stars
Budget Phone with Decent Performance for Basic Needs",1.0
B0CBTZ73WX,"UMIDIGI A15 Cell Phones (16G+256G), Android 13 Mobile Phone, 64MP Main Camera Octa Core Smartphone Unlocked 6.7” HD+ Full-View Waterdrop Screen, 5000mAh Battery 20W Fast Charging, 4G Dual SIM, GPS/NFC",169.99,4.3,16,https://www.amazon.com/product-reviews/B0CBTZ73WX/ref=cm_cr_dp_d_show_all_top?ie=UTF8&reviewerType=all_reviews,Smartphones,R30V5GEYGCE8J6,4.0,"4.0 out of 5 stars
Good Mid Low Budget Phone",4.0,R1OFI954D2T1HC,4.0,"4.0 out of 5 stars
Value for money if it last",0.0,R3NTK8AIJ39FR1,5.0,"5.0 out of 5 stars
Best phone on this price range!",2.0,R1OBLRRBZJJJ0B,5.0,"5.0 out of 5 stars
It is everything it says it is. Comfortable, lightweight and overall a great “mid” phone",4.0,RVBRJKI9EFAXJ,5.0,"5.0 out of 5 stars
Good price and quality",2.0
B09Q98BRRN,"SAMSUNG Galaxy A03 Core (SM-A032/DS) Dual SIM 32GB/ 2GB RAM, GSM Unlocked International Version - No Warranty - Black",85.99,3.8,1723,https://www.amazon.com/product-reviews/B09Q98BRRN/ref=cm_cr_dp_d_show_all_top?ie=UTF8&reviewerType=all_reviews,Smartphones,RU3FNJ5AWR94H,4.0,"4.0 out of 5 stars
A Great VoIP Phone, Definitely not for much else",1.0,RUS8DMUKKIIPG,4.0,"4.0 out of 5 stars
battery is really good  and hold up",0.0,R1G65GIMLSTF5J,5.0,"5.0 out of 5 stars
durability & quite convienent, got a good batch of stock from the seller",9.0,R10S1AA0E8WQPG,2.0,"2.0 out of 5 stars
Issues Build Up.",1.0,R2EUYI6DXWBMGE,4.0,"4.0 out of 5 stars
Value for money",0.0
B09WZZFXCB,"Xgody X60 Pro Unlocked Smartphones, 6.5 Inch Android 9.1 OS Cheap Cell Phones, 2022 4G Dual 5MP Camera and Dual SIM Phones, 3000mAh Massive Battery, Face Recognition (Black)",75.99,3.1,322,https://www.amazon.com/product-reviews/B09WZZFXCB/ref=cm_cr_dp_d_show_all_top?ie=UTF8&reviewerType=all_reviews,Smartphones,R11QGSUNF0K5UK,2.0,"2.0 out of 5 stars
I guess it damaged",0.0,R3CH12MI4D01ES,3.0,"3.0 out of 5 stars
A bit slow",0.0,R267YKQ7IGQNI6,5.0,"5.0 out of 5 stars
the quality",0.0,R2UIAGEBCYPXHC,3.0,"3.0 out of 5 stars
I received something different",1.0,R2XTGS42QTKSU6,1.0,"1.0 out of 5 stars
Did NOT Work",1.0
B09VXTLYKD,"autrebits Wireless Earbuds for iPhone, Bluetooth 5.2 Headphones in Ear Lightweight with Removable Eartips Waterproof and Sweat Resistant Sport in Ear Buds Charging Case for Workout Relaxing, Black",29.99,4.4,115,https://www.amazon.com/product-reviews/B09VXTLYKD/ref=cm_cr_dp_d_show_all_top?ie=UTF8&reviewerType=all_reviews,Smartphones,R2B5RDMGLJBRRV,4.0,"4.0 out of 5 stars
Buena compra costo beneficio",0.0,R2IU7O5AZP0B3R,4.0,"4.0 out of 5 stars
Very Very Good",0.0,RBX8OXRG945WS,4.0,"4.0 out of 5 stars
Todo",0.0,R3RACJWD0H31QD,4.0,"4.0 out of 5 stars
Cubren el sonido muy bien",0.0,R3AR3URJ0RFDQS,4.0,"4.0 out of 5 stars
wife says they are great",0.0
