category,product,price,ratings,review_responders,reviews
Accessories,"Myra Bag Women Leather Star Shoulder Bag,adjustable leather handle, leather trim and star accent",39.99,4.5,,Price
Accessories,"Myra Bag Women Leather Star Shoulder Bag,adjustable leather handle, leather trim and star accent",39.99,4.5,,4.5
Accessories,"Yiwafu Spa Headband for Women, Sponge Headband for Washing Face, Makeup Headband, Skincare Headbands for Makeup Removal, Shower, Hair Accessories, Terry Cloth Headbands for Women(White,Pink,Black)",12.99,4.4,,1
Accessories,Grunge Gloves Fairy Grunge Accessories Ripped Glove Crochet Glove Grunge Clothes Fairy Grunge Aesthetic,9.99,4.7,,4.7
Accessories,SweatyRocks Women's Casual High Waist Pleated A-Line Midi Skirt with Pocket,36.89,3.9,,3.9
Accessories,Fashion 10 Sets 18 inch Doll Clothes and Accessories Play Set inlcude Mermaid Shinning Dress Outfits Bikini Hat Handbag (No Doll),27.99,5.0,,5.0
Accessories,OQQ Women's 2 Piece Crop Top Ribbed Seamless Workout Exercise Long Sleeve Crop Tops,28.98,4.5,,4.5
Accessories,The Peanutshell Newborn Clothes & Accessories Set | 30 Piece Layette Gift Set | Fits Newborn to 3 Months | Pink Elephant & Floral,74.99,4.8,,4.8
Accessories,GRACE KARIN Lace-up Cinch Belt Tied Corset Elastic Waist Belt,17.99,4.4,,4.4
Accessories,Geyoga Studded Belt Metal Punk Rock Rivet Belt Punk Leather Belt Threads Studded Goth Belt with Pyramid Studs for Women Men,12.99,4.2,,4.2
Accessories,"5-Pack Organic Burp Cloths for Baby Boys and Girls - Ultra Absorbent Burping Cloth, Burp Clothes, Newborn Towel - Milk Spit Up Rags - Burpy Cloth Bib for Unisex, Boy, Girl - Burp Cloths (Grayscape)",21.96,4.8,,5
Accessories,Looxii Muslin Burp Cloths 100% Cotton Muslin Cloths 12 Pack Large 20''x10'' Extra Soft and Absorbent Baby Burping Cloth for Boys and Girls (Dark Green),21.99,4.8,,4.8
Accessories,"Fistihon RV Clothes Drying Rack, Camper Drying Rack Aluminum, Versatile No Drilling or Nailing Anti-Rust Tower Hanger Rack for Ladder, RV, Camper, Trailer, Travel, Hotel, Home",48.98,4.6,,4.6
Accessories,"AstroAI Balaclava Ski Mask 2 Pack Winter Fleece Thermal Face Mask Cover for Men Women Warmer Windproof Breathable, Cold Weather Gear for Skiing, Outdoor Work, Riding Motorcycle & Snowboarding, Gray",19.99,4.3,,4.3
Accessories,ZITA ELEMENT 11 Pcs 18 Inch Girl Doll Clothes and Accessories - 5 Sets Doll Outfits + 2 Pairs Random Style Shoes for 18 in My Our Life Generation Life Doll Clothes Clothing Dress with Shoes,21.98,4.1,,4.1
Accessories,"CINPIUK Garment Steamer Ironing Gloves Anti Steam Glove Heat Resistant Garment Steamer Mitt, Garment Steamer Accessories for Clothes",9.59,4.4,,4.4
Accessories,OQQ Women's 2 Piece Dresses Ribbed Sleeveless Adjustable Spaghetti Strips Tops Mini Dress,23.99,4.4,,4.4
Accessories,"Headbands for Women 16 Pack Elastic Hair Bands for Women' Hair Non Slip Soft Cloth Fabric Sweat Headbands Yoga Running Sport Hair Accessories, Black White Gray Women Headbands",12.99,5.0,,1
Accessories,OQQ Women's 2 Piece Yoga Leggings Ribbed Seamless Workout High Waist Athletic Pants,25.00,4.3,,4.3
Accessories,Crochet Hats for Women Vintage Beanies Women Fox Hat Grunge Goth Beanies Hat Y2K Accessories Slouchy Beanies for Women,14.99,4.5,,4.5
Accessories,Balaclava Windproof Winter Face Mask Warm Fleece Ski Mask for Men and Women Cold Weather Motorcycle Bike Cycling Neck Warmer,12.99,4.6,,4.6
Accessories,"BABESIDE 8 Pcs Reborn Baby Doll Clothes with Bassinet for 17-22 Inch Baby Doll,Baby Doll Clothes Outfit Accessories fit Newborn Baby Doll Girl",39.99,4.6,,4.6
Accessories,"50 Pcs Doll Clothes and Accessories, 5 Wedding Gowns 5 Fashion Dresses 4 Slip Dresses 3 Tops 3 Pants 3 Bikini Swimsuits 20 Shoes for 11.5 inch Doll Christmas Stocking Stuffers Girls Gift Age 5-7 8-10",20.90,4.5,,4.5
Accessories,"12 Pieces Dog Shirts Pet Printed Clothes with Funny Letters Summer Pet T Shirts Cool Puppy Shirts Breathable Dog Outfit Soft Dog Sweatshirt for Pet Dogs Cats Accessories, 12 Styles (X-Large)",22.99,4.1,,4.1
Accessories,Dokotoo Womens 2023 Fall Corduroy Shacket Jacket Long Sleeve Button Down Color Block Hooded Coat with Pockets,45.89,4.4,,4.4
Accessories,AUTOMET Womens 2 Piece Outfits Long Sleeve Sweatsuits Sets Half Zip Sweatshirts with Joggers Sweatpants,52.99,4.6,,4.6
Accessories,G.C Girls Rapunzel Dress Princess Dress Up Costume Toddler Puff Sleeve Dresses Wig Crown Wand Jewelry Cosplay Clothes,29.88,4.8,,4.8
Accessories,Vintage Beanies Women Fox Hat Grunge Accessories Slouchy Beanies for Women Crochet Hats for Women,9.99,4.5,,4.5
Accessories,SOLY HUX Women's Y2k Gothic Lace Trim Cami Crop Top Sleeveless Sexy Tank Tops Camisole Clubwear Outfit,20.99,4.5,,4.5
Accessories,"TIDEWE Hunting Clothes for Men with Fleece Lining, Safety Strap Compatible Water Resistant Silent Hunting Jacket and Pants",99.99,4.5,,4.5
Accessories,ODODOS Women's Crop 3-Pack Washed Seamless Rib-Knit Camisole Crop Tank Tops,28.98,4.4,,4.4
Accessories,NOKUTIP 161 PCS 11.5 Inch Girl Doll Closet Wardrobe with Clothes and Accessories Including Wardrobe Shoes Rack Clothes Dress Swimsuits Shoes Hangers Crown Necklace and Other Accessories,27.99,4.5,,4.5
Accessories,"Sweet Dolly Doll Clothes 5 Set New Born Baby Doll Clothes, Jumpsuits and Bows Headbands for 14 Inches to 18 Inches Dolls, 15 Inch New Born Baby Dolls, 10 PCs in Total Doll Clothes and Accessories",19.99,4.6,,4.6
Accessories,Dokotoo Women's Oversized Denim Jacket Casual Long Boyfriend Distresse Jean Jacket Autumn Spring,46.95,4.2,,4.2
Accessories,85PCS Doll Clothes and Accessories with Doll Closet for 11.5 Inch Doll - Fashion Design Doll Set Including Wedding Dress Fashion Dresses Outfits Tops and Pants Shoes Hangers Bags for Girls,24.99,4.7,,4.7
Accessories,ANRABESS Women 2023 Fall Crewneck Long Sleeve Oversized Cable Knit Chunky Pullover Short Sweater Dresses,43.99,4.2,,4.2
Accessories,"TERSE Headbands for Women Short Hair Non Slip Elastic Sweat Hairbands Soft Fabric Cloth Hair Bands for Women's Hair, Workout Yoga Running Sport Thin Hair Wrap for Girls",15.99,4.3,,1
Accessories,Disney Mickey Mouse Newborn Baby Zip Up Coverall Bodysuits T-Shirts Pants Bibs Hats Mitts and Blanket 15 Piece Layette Set,41.99,4.5,,4.5
Accessories,"ebuddy Doll Clothes and Accessories 18 Inch Doll Travel Set with Unicorn Printed Luggage Suitcase Fit for 18 inch Girl Doll,Most 18 Inch Dolls(No Doll)",25.99,4.2,,4.2
Accessories,SweatyRocks Women's Color Block Butterfly Print Striped Long Sleeve Crop Top T Shirt,25.99,4.5,,4.5
Accessories,ebuddy 10 Sets 18 Inch Doll Clothes 18 Inch Doll Clothes and Accessories Fit for 18 inch Dolls 18 Inch Girl Doll,27.99,4.5,,4.5
Accessories,AUTOMET Womens Casual Plaid Shacket Button Down Long Sleeve Shirt,32.99,4.4,,4.4
Accessories,Gelante Canvas Double Grommet Hole Belt 12 Colors,8.79,4.3,,4.3
Accessories,"84 Pcs Doll Clothes and Accessories with Doll, Princess Gowns, Fashion Dresses, Top & Pant/Jumpsuit, Sunhat, Swimsuits, Shoes, Hangers, Doll Dress up Toys for Girls Kids Toddlers Toy Gifts",17.99,4.0,,4.0
Accessories,Carhartt Women's Crawford Bomber Jacket,69.99,4.7,,4.7
Accessories,"65 Pcs Doll Clothes and Accessories Set 5 Fashion Dresses, 3 Wedding Party Gowns, 5 Slip Skirts, 4 Tops Pants Outfits, 3 Bikini Swimsuits, 20 Shoes, 20 Hangers, 5 Crowns for 11.5 Inch Girl Dolls Stuff",19.99,4.7,,Price
Accessories,ZITA ELEMENT 24 Pcs 18 Inch Girl Doll Clothes and Accessories - Doll Clothing Outfits Dress Swimsuits Tights for 18 Inch Dolls Christmas Birthday Gift,27.96,4.7,,4.7
Accessories,Columbia PHG Logo Mesh Snap Back,30.00,4.5,,4.5
Accessories,JIZHI 8 Pcs Reborn Baby Doll Clothes for 17-22 Inch Baby Doll with Bassinet Baby Doll Clothes Outfit Accessories fit Newborn Baby Doll Girl,39.99,5.0,,5.0
Accessories,"MELDEVO Wooden Tree Coat Rack Stand, 6 Hooks - 3 Adjustable Sizes Free Standing Coat Rack, Hallway/Entryway Coat Hanger Stand for Clothes, Suits, Accessories",16.99,4.7,,4.7
Accessories,OQQ Women's 3 Piece Tank Tops Ribbed Seamless Workout Exercise Shirts Yoga Crop Tops,25.99,4.3,,4.3
Accessories,"Barbie Closet Playset with 3 Outfits, Styling Accessories and Hangers, Mix-And-Match Barbie Clothes for 50+ Looks (Amazon Exclusive)",21.75,4.8,,4.8
Accessories,40 PCS Doll Clothes and Accessories 6 Pants Outfits 10 Shoes 15 Pcs Makeup Accessories and 9 Tableware Accessories for 11.5 inch Doll Girl Dolls,12.99,4.3,,4.3
Accessories,Aelfric Eden Oversized Knit Sweater Solid Vintage Pullover Sweater Unisex Woven Crewneck Knitted Tops,48.95,4.4,,4.4
Accessories,"BABESIDE 8 Pcs Reborn Baby Doll Accessories with Bassinet for 17-22 Inch Baby Doll,Baby Doll Clothes Outfit Accessories fit Reborn Doll Newborn Boy",39.99,4.5,,4.5
Accessories,"The Peanutshell Newborn Clothes & Accessories Set | 30 Piece Layette Gift Set | Fits Newborn to 3 Months | Navy, Blue, White | Elephant & Stars",74.99,4.7,,4.7
Accessories,Disney Ladies Lilo and Stitch Sweatshirt - Ladies Classic Lilo and Stitch Ohana - Multi Print Allover Hoodie Sweatshirt,59.99,4.8,,4.8
Accessories,17Pcs 18 Inch Girl Doll Clothes and Accessories Doll Accessories Case Luggage Travel Play Set with Travel Pillow Camera Sunglasses for 18 Inch Dolls Travel Storage Gift for Girls,21.99,4.5,,4.5
Accessories,The Peanutshell Newborn Clothes & Accessories Set for Baby Boys - 23 Piece Layette Gift Set - Fits Newborn to 3 Months - Dinosaur,59.99,4.7,,4.7
Accessories,"LIENAHU Aluminum Clothes Drying Rack,Laundry Drying Rack,Wall Mounted Clothes Hanger,Laundry Rack Folding,Retractable,Collapsible Clothes Hanging Rack(Hooks,Black)",33.95,4.5,,4.5
Accessories,Verdusa Women's 90s Top Bell Long Sleeve Tie Front Textured Sheer T-Shirt Cardigan,25.99,4.2,,4.2
Accessories,ANRABESS Women's Oversized Zip Up Hoodies Sweatshirts Y2K Clothes Teen Girl Fall Casual Drawstring Jackets with Pockets,31.99,4.5,,4.5
Accessories,PRETTYGARDEN Women's Plaid Shacket 2023 Long Sleeve Button Up Flannel Shirt Winter Tartan Jacket Woolen Coats,44.99,4.4,,4.4
Accessories,ZITA ELEMENT 7 Pcs 18 Inch Girl Doll Clothes and Accessories - 18 Inch Doll Clothes with Fanny Pack Toy Tablet Phone Camera and Kids Unicorn Backpack - Best Gift for Girls,23.59,4.4,,4.4
Accessories,ZAFUL Women's Plaid Long Sleeve Shirt Button Down Wool Blend Thin Jacket Casual Blouse Tops with Pocket,33.99,4.1,,4.1
Accessories,Y2k Hat Grunge Accessories Slouchy Beanies for Women Vintage Beanies Winter Warm Hat for Men Women Knitted Beanies,11.99,4.3,,4.3
Accessories,SheIn Women's 6 Pieces Outfits Tank Crop Top and Elastic Waist Shorts Lounge Set,49.99,4.2,,4.2
Accessories,"Barbie Dream Closet Playset, 35+ Clothes & Accessories Including 5 Complete Looks, Pop-Up Second Level, Mirror & Laundry Chute",39.99,4.8,,4.8
Accessories,OQQ Women's 3 Piece High Waist Workout Shorts Butt Lifting Tummy Control Ruched Booty Smile Yoga Short Pants,27.99,4.2,,4.2
Accessories,19 PCS Doll Clothes for Ken Doll Including Handmade 1 Suit 5 Tops 5 Pants Casual Wear 2 Beach Pants 4 Pair of Shoes 1 Glasses 1 Surfboard for 11.5 Inch Boy Doll Outfits for Boyfriend Doll in Random,12.99,4.0,,4.0
Accessories,"Reborn Dolls Baby Clothes Pink Outfits for 20""- 22"" Reborn Doll Girl Baby Clothing Baby Sets",12.99,4.7,,4.7
Accessories,OQQ Women's 2 Piece Yoga Leggings Ribbed Seamless Workout High Waist Cross Over Athletic Exercise Leggings,30.99,4.5,,4.5
Accessories,"150 Pack Doll Closet Wardrobe Set Contain 19 Pack Complete Clothes and 131 Pieces Doll Accessories - Wardrobe, Shoes, Necklace, Bags and More for 11.5 Inch Doll",19.90,4.5,,4.5
Accessories,PRETTYGARDEN Women's 2023 Fall Sweatshirt Half Zip Collar Pullover Tops Oversized Long Sleeve Plain Casual Jacket Clothes,33.99,4.3,,4.3
Accessories,ReeRaa 20 pcs 18 inch Doll Clothes and Accessories for American 18 inch Girl Doll Clothes Gift Including 10 Complete Sets of Clothing,27.99,4.5,,4.5
Accessories,OQQ Women's 3 Piece Medium Support Crop Top Seamless Ribbed Removable Cups Workout Yoga Sport Bra,25.98,4.4,,4.4
Accessories,"ACMETOP 20 Pack Cedar Hang Ups, 100% Natural Cedar Blocks for Clothes Storage, Aromatic Cedar Balls Hangers, Storage Accessories Closets & Drawers",27.99,4.3,,4.3
Accessories,Reborn Baby Dolls Clothes 22 inch Outfit Accessories Yellow Duck 5pcs Set for 20-22 Inch Reborn Doll Newborn Girl&Boy,11.99,4.8,,4.8
Accessories,"122 Pcs Doll Clothes and Accessories with Closet(Include Doll), Princess Gowns Fashion Dresses Top & Pant/Jumpsuit Swimsuits Shoes Hangers, Doll Dress up Toys for Girls Kids Toddlers Toy Gifts",24.99,4.6,,4.6
Accessories,Billabong Women's Wild Pursuit Short Overall,49.95,4.0,,4.0
Accessories,SOTOGO 42 Pieces Doll Clothes for 12 Inch Boy Doll Include 19 Sets Doll Clothes Casual Clothes Career Clothes Jacket Pants Outfits and 4 Beach Shorts,16.99,4.4,,4.4
Accessories,The Peanutshell Newborn Layette Gift Set for Baby Boys - 23 Piece Newborn Boy Clothes & Accessories Set - Fits Newborn to 3 Months - Blue Camo,59.99,4.8,,4.8
Accessories,SOLY HUX Women's Butterfly Print Drawstring High Waisted Sweatpants Joggers Pants,26.99,4.4,,4.4
Accessories,"The Peanutshell Newborn Clothes & Accessories Set, 23 Piece Baby Girl Layette Gift Set, Fits Newborn to 3 Month",59.99,4.8,,4.8
Accessories,SheIn Women's 3 Sets Rib Knit Lounge Set Crop Cami Top and Tie Front Shorts Sleepwear Pajama Set,42.99,4.5,,4.5
Accessories,"HOAKWA 10 Sets Alive Doll Clothes and Accessories Fits 10-11-12 Inch Baby Dolls, American 14-14.5 Inch Dolls, with Underwear and Hair Clip Doll Clothing Dress Outfits",19.90,4.4,,4.4
Accessories,Carhartt Men's Knit Cuffed Beanie,19.99,4.8,,4.8
Accessories,65 PCS Clothes and Accessories for Barbie Including 5 Wedding Gown Dresses 10 Slip Dress 2 Fashion Dresses 2 Tops 2 Pants 2 Bikini 20 Shoes 22 Accessories for 11.5 Inch Dolls in Random,16.99,3.9,,3.9
Accessories,The Peanutshell Newborn Layette Gift Set for Baby Boys or Girls - 23 Piece Gender Neutral Newborn Clothes & Accessories Set - Safari Themed,59.99,4.8,,Price
Accessories,The Peanutshell Newborn Layette Gift Set for Baby Boys or Girls - 23 Piece Gender Neutral Newborn Clothes & Accessories Set - Safari Themed,59.99,4.8,,4.8
Accessories,"mizeo Spa Headband for Women,Sponge Terry Cloth Fabric Head Band,Soft&Non Slip Hair Band for Washing Face,Makeup,Skincare,Shower,Hair Accessories（Blue）",8.90,4.7,,1
Accessories,Urban CoCo Women's Shiny Flared Pleated Mini Skater Skirt,17.85,4.1,,4.1
Accessories,Knowyou 6 Pack Seamless Thongs for Women Sexy No Show Breathable Underwear Stretch Straps T-Back Tangas Panties for Ladies,13.56,4.5,,|
Accessories,Knowyou 6 Pack Seamless Thongs for Women Sexy No Show Breathable Underwear Stretch Straps T-Back Tangas Panties for Ladies,13.56,4.5,,4.5
Accessories,"ANIVIVO Skirted Legging for Women, Yoga Legging with Skirts &Women Tennis Leggings Clothes Pockets",24.45,4.4,,4.4
Accessories,Flowy Athletic Shorts for Women Running Tennis Butterfly Shorts Girls 2-in-1 Double Layer Quick-Drying Comfy Shorts,19.98,4.4,,4.4
Accessories,"MARENA Recovery Mid-Calf-Length Girdle High-Back, Stage 2 (pull on), XXXL, Black",132.00,4.3,,4.3
Accessories,"Maui Rippers Women’s 5"" 4-Way Stretch Swim Shorts Boardshorts",39.95,4.5,,4.5
Accessories,The Peanutshell Newborn Layette Gift Set for Baby Boys - 23 Piece Newborn Boy Clothes & Accessories Set - Fits Newborn to 3 Months - Blue Camo,59.99,4.8,,4.8
Accessories,Lviefent Womens Lightweight Full Zip Running Track Jacket Workout Slim Fit Yoga Sportwear with Thumb Holes,19.16,4.4,,4.4
Dresses,ZAFUL Women Halterneck Satin Mini Dress Sexy Cowl Neck Silky Party Cocktail Club Dress,29.99,4.0,,Price
Dresses,ZAFUL Women Halterneck Satin Mini Dress Sexy Cowl Neck Silky Party Cocktail Club Dress,29.99,4.0,,4.0
Dresses,REORIA Women's Summer Casual Lounge Long Dress Elegant Short Sleeve Crew Neck Bodycon Maxi Dresses,36.99,4.7,,4.7
Dresses,CUPSHE Women's Floral Print Chiffon A-Line Mini Dress Long Peasant Sleeves,44.99,4.1,,4.1
Dresses,QINSEN Women's Square Neck Bodice Dress Sleeveless Tank Top Stretch Flare Mini Dresses,32.99,4.1,,4.1
Dresses,ANRABESS Women's Deep V Neck Short Sleeve Long Dresses Pleated High Waist Slit Club Party Evening Maxi Dress,49.99,3.9,,3.9
Dresses,ZAFUL Women's Satin Sleeveless Spaghetti Strap Mini Dress Side Slit Cowl Neck Cocktail Party Dresses,40.99,3.7,,3.7
Dresses,ANRABESS Women's Casual Loose Short Sleeve Long Dress Split Maxi Summer Beach Dress with Pockets,36.99,4.3,,4.3
Dresses,Dokotoo Womens 2023 Spring Summer Deep V Neck Elegant Bow tie Mini Dress S-XL,28.04,4.4,,4.4
Dresses,ANRABESS Women's Square Neck Mesh Long Sleeve Ruched Bodycon Mini Dress Party Club Cocktail Short Dresses,39.99,4.2,,4.2
Dresses,ZAFUL Women's Square Neck Off Shoulder Tie Back Long Lantern Sleeve Ruffle Short Dress A-Line Mini Dress,29.99,4.2,,4.2
Dresses,ANRABESS Women's 2023 Summer Bohemian One Shoulder Sleeveless Smocked Ruffle Tiered Beach Maxi Sun Dress,21.99,4.2,,4.2
Dresses,CUPSHE Womens V Neck Floral Mini Dress Long Sleeve A Line Surplice,39.99,4.0,,4.0
Dresses,ANRABESS Women's Elegant Bridesmaid Dresses Square Neck Ruffle Split Midi Formal Dress for Wedding Guest Cocktail Party,45.99,4.2,,4.2
Dresses,Amazon Essentials Women's Classic Cap Sleeve Wrap Dress (Available in Plus Size),40.60,4.3,,4.3
Dresses,LYANER Women's Collar V Neck Button Down Pleated Long Sleeve Mini Shirt Dress with Belt,41.99,4.1,,4.1
Dresses,SheIn Women's Wrap Tie Side Scoop Neck Bodycon Midi Dress Sleeveless Asymmetrical Tank Dresses,27.99,4.0,,4.0
Dresses,Amazon Essentials Women's Standard Short-Sleeve V-Neck Swing Dress,14.63,4.2,,Amazon’s
Dresses,Amazon Essentials Women's Standard Short-Sleeve V-Neck Swing Dress,14.63,4.2,,4.2
Dresses,Amazon Essentials Women's Relaxed Fit Half-Sleeve Waisted Midi A-Line Dress,25.42,4.1,,4.1
Dresses,Amazon Essentials Women's Short-Sleeve Midi Button Front Tie Dress,27.97,4.0,,4.0
Dresses,Amazon Essentials Women's Jersey Sleeveless Gathered Midi Dress (Previously Daily Ritual),20.93,4.3,,4.3
Dresses,Amazon Essentials Women's Sleeveless Woven Shift Dress,23.70,4.2,,4.2
Dresses,REORIA Women's Sexy Lounge Slip Long Dress Elegant Sleeveless Backless Ribbed Bodycon Maxi Dresses,34.99,4.5,,4.5
Dresses,SheIn Women's Sleeveless Criss Cross Backless Side Split Strappy Party Maxi Dress,19.99,3.5,,3.5
Dresses,GRACE KARIN Women's Summer Wedding Guest Dress Elegant One Shoulder Cocktail Dress Ruffle Short Sleeve A Line Party Dress,42.98,4.4,,4.4
Dresses,CUPSHE Women Summer Halter Smocked Maxi Dress Plunge Sleeveless Long Solid Fitted Waist Dress Grey,39.99,3.5,,3.5
Dresses,ANRABESS Women's One Shoulder Ruched Bodycon Mini Dress Puff Long Sleeve Sexy Cocktail Party Short Dress,36.99,4.5,,4.5
Dresses,Amoretu Women Summer Tunic Dress V Neck Casual Loose Flowy Swing Shift Dresses,25.45,3.9,,3.9
Dresses,GRACE KARIN Women's Summer Bridesmaid Dresses for Wedding V Neck Ruffle Party Cocktail Dresses Chiffon Flowy Wrap Dress,47.99,4.0,,4.0
Dresses,ANRABESS Women's Sexy V Neck Ruched Bodycon Mini Dress Puff Long Sleeve Cocktail Wedding Party Short Dresses,36.99,3.9,,3.9
Dresses,GRACE KARIN Women's Sequin Sparkly Party Dress Cocktail Bodycon Glitter Dresses Long Sleeve,49.99,4.0,,4.0
Dresses,ANRABESS Women's Crewneck Long Sleeve Tie Waist A-Line Swing Bodycon Short Dress Casual Solid Ribbed Knit Sweater Dress,39.99,4.3,,4.3
Dresses,ANRABESS Women's Summer Casual Short Sleeve Crewneck Swing Dress Casual Flowy Tiered Maxi Beach Dress with Pockets,36.99,4.4,,4.4
Dresses,Amazon Essentials Women's Relaxed Fit Half-Sleeve Waisted Midi A-Line Dress,28.50,4.1,,4.1
Dresses,ANRABESS Women's Casual Summer Midi Dress Puffy Short Sleeve Square Neck Smocked Tiered Boho Dresses,29.99,4.1,,4.1
Dresses,BROVAVE Women's 2023 Summer Casual Boho Sundress Polka Dot Spaghetti Strap V Neck Flowy Midi Dresses,33.99,4.2,,4.2
Dresses,Cosonsen Women's Dress Deep V-Neck Long Sleeve Waist Tie Ruffle Mini Swing Skater Dresses,35.99,4.2,,4.2
Dresses,ZAFUL 2023 Boho Maxi Dress for Women A Line Tie Waist Summer Dress Deep V Neck Smocked Wrap Dress,39.99,3.6,,3.6
Dresses,ANRABESS Women's Casual Loose Sundress Long Dress Sleeveless Split Maxi Dresses Summer Beach Dress with Pockets,36.99,4.3,,4.3
Dresses,KOJOOIN Women's Striped Flutter Sleeve Wrap Tie Waist T Shirt Dress Summer V Neck Button Down A Line Mini Dresses,16.99,3.9,,3.9
Dresses,ANRABESS Women’s Summer Loose Kimono Maxi Dress Wrap V Neck 3/4 Sleeve Floral Print Slit Long Dresses,47.99,4.0,,4.0
Dresses,Bbonlinedress Women Short 1950s Retro Vintage Cocktail Party Swing Dresses,36.99,4.0,,4.0
Dresses,KIRUNDO Women's Long Sleeve Ruffle Mock Neck Tiered Mini Babydoll Dress Casual Swing Tunic Shift Dresses,45.99,4.3,,4.3
Dresses,REORIA Women’s Sexy Lounge Slip Short Dress Casual Sleeveless Backless Ribbed Bodycon Mini Dresses,26.99,4.2,,4.2
Dresses,REORIA Women's Summer Sexy Lounge Tank Long Dress Elegant Sleeveless Halter Neck Bodycon Maxi Dresses,34.99,4.5,,4.5
Dresses,ANRABESS Women’s Summer Casual Loose Sleeveless Spaghetti Strap Asymmetric Tiered Beach Maxi Long Dress,44.99,4.1,,4.1
Dresses,ANRABESS Women’s Summer Casual V Neck Babydoll Dress Ruffle Short Sleeve Tiered A-Line Flowy Mini Beach Dress,37.99,3.6,,3.6
Dresses,PRETTYGARDEN Women's Casual Summer Dresses Trimmed Short Sleeve V Neck Tie Front Flowy Dress,42.99,3.9,,3.9
Dresses,ZAFUL Women Dress Square Neck Off Shoulder Long Puff Sleeve Smocked High Waist Casual A Line Dress,35.99,3.8,,3.8
Dresses,GRACE KARIN Women's Summer Midi Dresses Cap Sleeve Tie Waist Work Dress Slit V-Neck Bodycon Dress Business Casual Outfits,29.99,4.1,,4.1
Dresses,ANRABESS Women's Floral Midi Dress Puff Long Sleeve Ruffle Trim Smocked A-line Pleated Swing Chiffon Dresses with Belt,42.99,4.1,,4.1
Dresses,ARTFREE Women's Long Lantern Sleeves Mini Dress V Neck Button Down Ruffle Tiered Swing Summer Casual Dress,37.99,4.3,,4.3
Dresses,GRACE KARIN Women's Long Sleeve Midi A Line Dress Gold Dot Round Neck Ruffle Tiered Belt Wedding Guest Dress with Slit,39.99,4.4,,4.4
Dresses,Ekouaer Womens Satin Nightgown Sexy Lingerie Sleepwear Spaghetti Strap Cowl Neck Elegant Long Slip Satin Silk Midi Dress,19.99,4.1,,4.1
Dresses,MEROKEETY Women's 3/4 Balloon Sleeve Striped High Waist T Shirt Midi Dress with Pockets,36.99,4.2,,4.2
Dresses,WDIRARA Women's Short Sleeve Notched V Neck Tunic Dress Casual Solid Dresses,35.99,4.1,,4.1
Dresses,LYANER Women's Collar V Neck Button Down Pleated Long Sleeve Mini Shirt Dress with Belt,41.99,4.1,,4.1
Dresses,PRETTYGARDEN Women's Floral Maxi Dress 2023 Knot One Shoulder Sleeveless Ruffle Hem Flowy Boho Dresses,25.99,4.1,,4.1
Dresses,The Dresser,3.99,4.3,,Price
Dresses,The Dresser,3.99,4.3,,2016
Dresses,ANRABESS Women 2023 Summer Sleeveless Ruch Bodycon High Waist Asymmetric Slit Cocktail Maxi Dress,44.99,4.0,,4.0
Dresses,ANRABESS Women's 2023 Fall Elegant Sweater Dress Long Sleeve Crewneck Tie Waist Slim Rib Knit Slit Bodycon Midi Dress,35.99,4.5,,4.5
Dresses,GRACE KARIN Women's Work Pencil Dress Wedding Guest Office Dresses Cocktail Party Long Sleeve,46.99,4.1,,4.1
Dresses,ANRABESS Women Summer Satin Strapless Formal Dress Sexy Backless Bodycon Wedding Cocktail Party Maxi Dress,47.99,4.1,,4.1
Dresses,Amazon Essentials Women's Short-Sleeve Scoop Neck Swing Dress (Available in Plus Size),14.93,4.3,,4.3
Dresses,ANRABESS Women Midi Sweater Dress Long Sleeve Crewneck High Waist Casual A-Line Pleated Dresses,36.99,4.4,,4.4
Dresses,Ezbelle Women's 2023 Summer Dress Off The Shoulder Short Sleeve Ribbed Casual Party Bodycon Midi Dresses,40.99,4.4,,4.4
Dresses,SweatyRocks Women's Graphic Short Sleeve Belted Mini Dress A Line Flared Skater Dresses,35.99,4.1,,4.1
Dresses,The Dress,4.99,4.1,,by
Dresses,ANRABESS Women Tie Strap Sleeveless Square Neck Ruffle Dress High Waist A line Casual Boho Long Dress,21.49,4.3,,4.3
Dresses,ANRABESS Women's Sexy Bodycon Short Dress Ruched Sleeveless Club Party Mini Dress,37.99,3.8,,3.8
Dresses,ANRABESS Women’s Summer Short Sleeve Crewneck T Shirt Maxi Dress Tie Waist Casual Slim Fit Slit Beach Dresses,29.59,4.4,,4.4
Dresses,ANRABESS Women Satin One Shoulder Short Sleeve Ruched Bodycon Wrap Cocktail Party Midi Dress,53.99,3.8,,3.8
Dresses,ZAFUL Womens Satin Sexy Backless Wrap V Neck Sleeveless Spaghetti Strap Pleated Flowy Party Midi Dress,32.99,5.0,,5.0
Dresses,CUPSHE Geo Print Belted Combo Dress Short Sleeves Crew Neck Dresses Casual Summer,34.99,3.8,,3.8
Dresses,Amazon Essentials Women's Waisted Maxi Dress (Available in Plus Size),25.42,4.3,,4.3
Dresses,ANRABESS Women's Summer Ruffle Maxi Dress Floral Print 3/4 Bell Sleeve V Neck High Waist Flowy Boho Long Dress,45.99,4.0,,4.0
Dresses,"Hanes Originals Women's Garment Dyed Midi Dress, 100% Cotton Vintage Wash Ankle-Length Dress",17.49,3.9,,3.9
Dresses,ANRABESS Women's 2023 Fall Long Sleeve Sweater Dress Turtleneck Slim Fit Ribbed Knit Slit Midi Dress,42.99,4.4,,4.4
Dresses,Amazon Essentials Women's Long Sleeve Classic Wrap Dress (Available in Plus Size),38.00,4.0,,4.0
Dresses,LYANER Women's Satin V Neck Twist Ruffle Flowy Swing Short Sleeve Elegant Mini Dress,37.99,3.9,,3.9
Dresses,VUBIYA 2023 Summer Satin Tube Tops Slit Wedding Guest Dress for Women Elegant Strapless Halter Neck Cocktail Midi Dresses,42.99,4.3,,4.3
Dresses,EYNMIN Women's Sleeveless Slip Bodycon Corset Maxi Dress Spaghetti Strap Ruched Elegant Evening Party Long Dresses,47.99,4.3,,4.3
Dresses,ZAFUL Women's Spaghetti Strap Floral Summer Hollow Twist Front Maxi Dresses Sexy Cutout V Neck Backless Vacation Dress,38.99,4.1,,4.1
Dresses,CUPSHE Women's Lace Up Dresses Boho Tassel V-Neck Flare Ruffle Beach,47.99,4.2,,4.2
Dresses,ANRABESS Women's One Shoulder Cocktail Short Dress Glitter Sexy Ruched Bodycon Party Prom Formal Mini Dress,37.99,4.3,,4.3
Dresses,BLENCOT Womens Casual Floral Deep V Neck Long Sleeve Long Evening Dress Cocktail Party Maxi Wedding Dresses,49.98,4.2,,4.2
Dresses,CUPSHE Women's Drawstring Short Sleeve Dress Short Sleeves Mini Dresses Casual Summer,37.99,3.9,,3.9
Dresses,CUPSHE womens Modern/Fitted,49.99,3.6,,3.6
Dresses,ZAFUL Slip Satin Dresses for Women Club Midi Dress Cowl Neck Silk Dress Cocktail Dress with Drawstring,19.99,4.0,,4.0
