category,product,price,ratings,review_responders,reviews
Shoes,Skechers Women's Microburst One up Fashion Sneaker,47.33,4.3,,4.3
Shoes,New Balance Men's Slip Resistant 626 V2 Industrial Shoe,70.26,4.4,,4.4
Shoes,Clarks Women's Cheyn Madi Slip-On Loafer,27.00,4.5,,4.5
Shoes,Skechers Men's Classic Fit-Delson-Camden Sneaker,42.14,4.6,,4.6
Shoes,Lugz Women's Clipper Slip-Resistant Work Shoe Food Service,34.99,4.2,,Price
Shoes,Lugz Women's Clipper Slip-Resistant Work Shoe Food Service,34.99,4.2,,4.2
Shoes,Skechers Men's Nampa-Groton Food Service Shoe,44.99,4.4,,4.4
Shoes,Skechers Men’s Summits High Range Slip-in,75.00,4.6,,4.6
Shoes,adidas Men's Swift Run Sneaker,71.00,4.2,,4.2
Shoes,Bruno Marc Men's Dress Shoes Formal Classic Lace-up Oxfords,25.49,4.4,,4.4
Shoes,Soda Shoes Efron-S Women Flip Flops Basic Plain Slippers Slip On Sandals Slides Casual Peep Toe Beach,19.88,4.2,,4.2
Shoes,Sperry Men's Bahama Ii Boat Shoe,39.69,4.6,,4.6
Shoes,Under Armour Men's Charged Assert 10 Running Shoe,60.51,4.5,,4.5
Shoes,SVNKE Men's Casual Dress Oxfords Shoes Breathable Knit Leisure Fashion Sneakers Lightweight Comfortable Walking Shoes,36.99,4.0,,4.0
Shoes,Shoes: Chocolate for the Feet,9.45,4.5,,4.5
Shoes,Bruno Marc Men's Dress Oxfords Denim Shoes,28.99,4.5,,4.5
Shoes,TOMS Women's Devon Sneaker,36.53,4.4,,4.4
Shoes,Easy Spirit Women's Equinox Mule,37.97,4.4,,4.4
Shoes,Bruno Marc Men's Dress Oxford Shoes Classic Lace Up Formal Cap Toe Shoes,42.99,4.4,,4.4
Shoes,Under Armour Men's Charged Pursuit 3 Running Shoe,59.99,4.4,,4.4
Shoes,Cole Haan Men's Tucker Venetian Slip-On Loafer,84.47,4.3,,4.3
Shoes,Joomra Whitin Men's Supportive Running Shoes Cushioned Lightweight Athletic Sneakers,43.99,4.4,,4.4
Shoes,"Avia Anchor SR Mesh Slip On Black Non Slip Shoes for Women, Comfortable Water Resistant Womens Food Service Sneakers - Black, Blue, or White Med or Wide Restaurant, Slip Resistant Work Shoes Women",39.98,4.1,,4.1
Shoes,"NETGEAR Wi-Fi Range Extender EX3700 - Coverage Up to 1000 Sq Ft and 15 Devices with AC750 Dual Band Wireless Signal Booster & Repeater (Up to 750Mbps Speed), and Compact Wall Plug Design",55.14,3.8,,3.8
Shoes,Blowfish Malibu Sadie,38.40,4.4,,4.4
Shoes,"Vionic Women's Vortex Jolisa Lace Up Knit Athletic Shoes - Ladies Supportive Walking Sneakers That Include Three-Zone Comfort with Orthotic Insole Arch Support, Medium and Wide Fit Sizes 5-12",34.97,3.9,,3.9
Shoes,CAMVAVSR Men's Sneakers Fashion Lightweight Running Shoes Tennis Casual Shoes for Walking,26.99,4.2,,4.2
Shoes,"Avia Flame Slip Resistant Clogs for Women, Slip On Work Shoes for Food Service, Garden, or Nursing",29.98,4.0,,4.0
Shoes,Bruno Marc Men's Oxford Dress Shoes,29.99,4.4,,4.4
Shoes,Cole Haan Men's 2.0 Zerogrand Stitchlite Oxford,70.00,4.6,,4.6
Shoes,ASICS Men's VERSABLAST 2 Running Shoes,39.95,4.5,,4.5
Shoes,Soda WAIT-A ~ Women Open Round Toe Chunky Heel Ankle Strap High Heel Dress Sandals,26.88,4.5,,4.5
Shoes,Amazon Essentials Women's D'Orsay Flat Ballet,24.70,4.0,,4.0
Shoes,Brooks Men's Revel 5 Neutral Running Shoe,59.95,4.6,,4.6
Shoes,WHITIN Men's Do-It-All Slip On Loafers | Foam-Cushioned Footbed | Moc Toe Inspired,22.99,4.4,,4.4
Shoes,Bruno Marc Men's Dress Oxfords,29.99,4.5,,4.5
Shoes,JBU by Jambu Women's Synergy Mesh Water Ready Sneaker,29.50,4.3,,4.3
Shoes,WHITIN Men's Wide Toe Box Barefoot Shoes | Canvas Minimalist Sneakers | Zero Drop Sole,39.99,4.5,,4.5
Shoes,WHITIN Men's Cross-Trainer | Barefoot & Minimalist Shoe | Zero Drop Sole | Wide Toe Box,43.88,4.3,,4.3
Shoes,Hanes Men's Textured Moccasin Slipper,28.99,4.3,,4.3
Shoes,Under Armour Men's Surge 3 Running Shoe,60.51,4.6,,4.6
Shoes,ASICS Women's Upcourt 5 Volleyball Shoes,54.95,4.6,,4.6
Shoes,Blowfish Malibu Women's Clay Canvas Sneaker,32.88,4.3,,4.3
Shoes,WHITIN Men's Wide Toe Box + Zero Drop Sole Road Running Shoes | Rubber Outsole,32.99,4.3,,4.3
Shoes,Hey Dude Women's Wendy Rise Lace Up Loafers,32.50,4.7,,4.7
Shoes,Soda Women's Closed Toe Multi Strap Ankle Bootie,32.17,4.4,,4.4
Smartphones,Google Pixel 4a - Unlocked Android Smartphone - 128 GB of Storage - Up to 24 Hour Battery - Just Black,99.99,4.4,163,Typical:
Smartphones,"SAMSUNG Galaxy A54 5G A Series Cell Phone, Factory Unlocked Android Smartphone, 128GB w/ 6.4” Fluid Display Screen, Hi Res Camera, Long Battery Life, Refined Design, US Version, 2023, Awesome Violet",449.99,4.4,163,163
Smartphones,"SAMSUNG Galaxy A54 5G A Series Cell Phone, Factory Unlocked Android Smartphone, 128GB w/ 6.4” Fluid Display Screen, Hi Res Camera, Long Battery Life, Refined Design, US Version, 2023, Awesome Violet",449.99,4.4,163,163
Smartphones,"Total by Verizon TCL 30 Z, 32GB, Black - Prepaid Smartphone (Locked)",29.88,4.0,206,206
Smartphones,"Total by Verizon TCL 30 Z, 32GB, Black - Prepaid Smartphone (Locked)",29.88,4.0,206,206
Smartphones,Google Pixel 4a - Unlocked Android Smartphone - 128 GB of Storage - Up to 24 Hour Battery - Just Black,314.99,4.5,"10,342",Shop
Smartphones,Google Pixel 4a - Unlocked Android Smartphone - 128 GB of Storage - Up to 24 Hour Battery - Just Black,314.99,4.5,"10,342","10,342"
Smartphones,Samsung Galaxy S20+ 5G 128GB Fully Unlocked Smartphone (Renewed),260.08,4.3,"3,993","3,993"
Smartphones,"Samsung Electronics Galaxy Note 20 Ultra 5G Factory Unlocked Android Cell Phone | US Version | 128GB of Storage | Mobile Gaming Smartphone | Mystic Bronze (Renewed), SM-N986UZNAXAA",339.00,4.1,"3,205","3,205"
Smartphones,Nokia C21 Plus | Android 11 (Go Edition) | Unlocked Smartphone | 2-Day Battery | Dual SIM | 2/64GB | 6.52-Inch Screen | Cyan,99.00,4.2,7,7
Smartphones,Nokia C21 Plus | Android 11 (Go Edition) | Unlocked Smartphone | 2-Day Battery | Dual SIM | 2/64GB | 6.52-Inch Screen | Cyan,99.00,4.2,7,7
Smartphones,"Apple iPhone 12, 64GB, Black - Unlocked (Renewed Premium)",460.00,4.2,"11,607","11,607"
Smartphones,"Apple iPhone 12, 64GB, Black - Unlocked (Renewed Premium)",460.00,4.2,"11,607","11,607"
Smartphones,"Apple iPhone 12 Mini, 64GB, Blue - Unlocked (Renewed)",285.00,4.2,"7,467","7,467"
Smartphones,"Apple iPhone 12 Mini, 64GB, Blue - Unlocked (Renewed)",285.00,4.2,"7,467","7,467"
Smartphones,Moto G 5G | 2022 | 2-Day Battery | Unlocked | Made for US by Motorola | 6/256GB | 50 MP Camera | Moonlight Gray,189.99,4.3,894,894
Smartphones,Moto G 5G | 2022 | 2-Day Battery | Unlocked | Made for US by Motorola | 6/256GB | 50 MP Camera | Moonlight Gray,189.99,4.3,894,894
Smartphones,"Tracfone Samsung Galaxy A03s, 32GB, Black - Prepaid Smartphone (Locked)",49.88,4.2,"1,100","1,100"
Smartphones,"Tracfone Samsung Galaxy A03s, 32GB, Black - Prepaid Smartphone (Locked)",49.88,4.2,"1,100","1,100"
Smartphones,OnePlus 11 5G | 16GB RAM+256GB | Dual-SIM | Titan Black | US Factory Unlocked Android Smartphone | 5000 mAh battery | 80W Fast charging | Hasselblad Camera | 120Hz Fluid Display | 4nm Processor,649.99,4.4,691,691
Smartphones,OnePlus 11 5G | 16GB RAM+256GB | Dual-SIM | Titan Black | US Factory Unlocked Android Smartphone | 5000 mAh battery | 80W Fast charging | Hasselblad Camera | 120Hz Fluid Display | 4nm Processor,649.99,4.4,691,691
Smartphones,"Xgody X60 Android Cell Phone Unlocked, 6 Inch QHD Waterdrop Screen, 2GB RAM+16GB ROM, Dual Sim Slots Smartphone, 5MP+5MP Camera, Facial Unlock, 3000mAh Mobile Phones (Black1)",71.99,5.0,3,3
Smartphones,"Xgody X60 Android Cell Phone Unlocked, 6 Inch QHD Waterdrop Screen, 2GB RAM+16GB ROM, Dual Sim Slots Smartphone, 5MP+5MP Camera, Facial Unlock, 3000mAh Mobile Phones (Black1)",71.99,5.0,3,3
Smartphones,Xiaomi Redmi Note 12s (256GB + 8GB) Global Unlocked (No Warranty) (Tmobile/Metro Tello/Mint USA Market) (w/Fast Car Charger Bundle) (Ice Blue),202.00,4.7,"2,552","2,552"
Smartphones,Xiaomi Redmi Note 12s (256GB + 8GB) Global Unlocked (No Warranty) (Tmobile/Metro Tello/Mint USA Market) (w/Fast Car Charger Bundle) (Ice Blue),202.00,4.7,"2,552","2,552"
Smartphones,"SAMSUNG Galaxy S22 Ultra Cell Phone, Factory Unlocked Android Smartphone, 128GB, 8K Camera, Brightest Display Screen, S Pen, Long Battery Life, Fast 4nm Processor, US Version, 2022, Phantom Black",989.00,4.6,"1,109","1,109"
Smartphones,"SAMSUNG Galaxy S22 Ultra Cell Phone, Factory Unlocked Android Smartphone, 128GB, 8K Camera, Brightest Display Screen, S Pen, Long Battery Life, Fast 4nm Processor, US Version, 2022, Phantom Black",989.00,4.6,"1,109","1,109"
Smartphones,"UMIDIGI A15 Cell Phones (16G+256G), Android 13 Mobile Phone, 64MP Main Camera Octa Core Smartphone Unlocked 6.7” HD+ Full-View Waterdrop Screen, 5000mAh Battery 20W Fast Charging, 4G Dual SIM, GPS/NFC",169.99,5.0,1,1
Smartphones,"UMIDIGI A15 Cell Phones (16G+256G), Android 13 Mobile Phone, 64MP Main Camera Octa Core Smartphone Unlocked 6.7” HD+ Full-View Waterdrop Screen, 5000mAh Battery 20W Fast Charging, 4G Dual SIM, GPS/NFC",169.99,5.0,1,1
Smartphones,"Apple iPhone 12 Pro Max, 128GB, Pacific Blue - Unlocked (Renewed Premium)",681.05,4.4,"1,636","1,636"
Smartphones,"Apple iPhone 12 Pro Max, 128GB, Pacific Blue - Unlocked (Renewed Premium)",681.05,4.4,"1,636","1,636"
Smartphones,"5G Unlocked Cell Phones,6G+256GB Dual Sim Smartphone, C21 Unlocked Mobile Phone with 7.3 inch Waterdrop Screen, Android Phone 24+64 MP | 7300mAh | Fingerprint Lock & Face ID | US Version (rose gold)",169.99,1.0,1,1
Smartphones,"5G Unlocked Cell Phones,6G+256GB Dual Sim Smartphone, C21 Unlocked Mobile Phone with 7.3 inch Waterdrop Screen, Android Phone 24+64 MP | 7300mAh | Fingerprint Lock & Face ID | US Version (rose gold)",169.99,1.0,1,1
Smartphones,"xixaomiro i14Pro Max Unlocked 5G Cellphone Android Smartphone Mobile Phone, 8GB RAM, 512GB ROM 1TB Expandable, 6.8'' FHD Screen, 6000mAh Battery, Dual Sim Card, 48+13MP Camera (Purple)",129.00,3.5,19,19
Smartphones,"xixaomiro i14Pro Max Unlocked 5G Cellphone Android Smartphone Mobile Phone, 8GB RAM, 512GB ROM 1TB Expandable, 6.8'' FHD Screen, 6000mAh Battery, Dual Sim Card, 48+13MP Camera (Purple)",129.00,3.5,19,19
Smartphones,"Apple iPhone 12 Pro Max, 128GB, Gold - Unlocked (Renewed Premium)",699.99,4.5,,4.5
Smartphones,"Apple iPhone 12 Pro Max, 128GB, Gold - Unlocked (Renewed Premium)",699.99,4.5,,4.5
Smartphones,"Apple iPhone 12 Pro Max, 128GB, Gold - Unlocked (Renewed Premium)",699.99,4.5,,4.5
Smartphones,Google Pixel 7-5G Android Phone - Unlocked Smartphone with Wide Angle Lens and 24-Hour Battery - 128GB - Obsidian,449.00,4.3,,4.3
Smartphones,Google Pixel 7-5G Android Phone - Unlocked Smartphone with Wide Angle Lens and 24-Hour Battery - 128GB - Obsidian,449.00,4.3,,4.3
Smartphones,"TCL 30XL Unlocked Cell Phone, 6.82 inch Vast Display, 5000mAh Battery, Android 12 Smartphone, 50MP Rear 13MP Front Camera, 6GB RAM 64GB ROM, US Version, Dual Speaker, LTE 4G Phone, Night Mist",119.99,4.1,,4.1
Smartphones,"TCL 30XL Unlocked Cell Phone, 6.82 inch Vast Display, 5000mAh Battery, Android 12 Smartphone, 50MP Rear 13MP Front Camera, 6GB RAM 64GB ROM, US Version, Dual Speaker, LTE 4G Phone, Night Mist",119.99,4.1,,4.1
Smartphones,"OnePlus Nord N30 5G | Unlocked Dual-SIM Android Smart Phone | 6.7"" LCD Display | 8 +128GB | 5000 mAh Battery | 50W Fast Charging | 108MP Camera | Chromatic Gray",269.99,4.4,,4.4
Smartphones,"OnePlus Nord N30 5G | Unlocked Dual-SIM Android Smart Phone | 6.7"" LCD Display | 8 +128GB | 5000 mAh Battery | 50W Fast Charging | 108MP Camera | Chromatic Gray",269.99,4.4,,4.4
Smartphones,"TCL 40XL 2023 Unlocked Cell Phone 4GB + 128GB, 6.75"" 90Hz Display, Smartphone Android 13, 50MP AI Camera Mobile Phone, 5000 mAh, 4G LTE, US Version, Dark Gray",139.99,4.0,,4.0
Smartphones,"TCL 40XL 2023 Unlocked Cell Phone 4GB + 128GB, 6.75"" 90Hz Display, Smartphone Android 13, 50MP AI Camera Mobile Phone, 5000 mAh, 4G LTE, US Version, Dark Gray",139.99,4.0,,4.0
Smartphones,"ExAchat M13 Pro 5G Unlocked Smartphone, 7.3"" Large Screen Android 13 Phone 6GB+256GB 108MP 7300mAh Dual SIM Cell Phone 5G Fingerprint/Face ID",149.99,4.3,,4.3
Smartphones,"ExAchat M13 Pro 5G Unlocked Smartphone, 7.3"" Large Screen Android 13 Phone 6GB+256GB 108MP 7300mAh Dual SIM Cell Phone 5G Fingerprint/Face ID",149.99,4.3,,4.3
Smartphones,"Total by Verizon Samsung Galaxy A03s, 32GB, Black - Prepaid Smartphone (Locked)",49.88,3.9,,3.9
Smartphones,"Total by Verizon Samsung Galaxy A03s, 32GB, Black - Prepaid Smartphone (Locked)",49.88,3.9,,3.9
Smartphones,"Xiaomi Redmi 12C 4G LTE (128GB + 4GB) Factory Unlocked GSM 6.71"" 50MP Dual Camera (ONLY T-Mobile/Mint USA Market) + (w/Fast Car Charger Bundle) (Graphite Gray)",114.70,4.7,,4.7
Smartphones,"Xiaomi Redmi 12C 4G LTE (128GB + 4GB) Factory Unlocked GSM 6.71"" 50MP Dual Camera (ONLY T-Mobile/Mint USA Market) + (w/Fast Car Charger Bundle) (Graphite Gray)",114.70,4.7,,4.7
Smartphones,"4G Unlocked Cell Phones,6G+256GB Dual Sim Smartphone, C23 Unlocked Mobile Phone with 7.3inch Waterdrop Screen, Android Phone 48+108 MP | 8000mAh | Fingerprint Lock & Face ID | US Version (Black)",169.99,2.8,,2.8
Smartphones,"4G Unlocked Cell Phones,6G+256GB Dual Sim Smartphone, C23 Unlocked Mobile Phone with 7.3inch Waterdrop Screen, Android Phone 48+108 MP | 8000mAh | Fingerprint Lock & Face ID | US Version (Black)",169.99,2.8,,2.8
Smartphones,"Apple iPhone 12 Mini, 64GB, Blue - Unlocked (Renewed Premium)",366.67,4.3,,4.3
Smartphones,"Apple iPhone 12 Mini, 64GB, Blue - Unlocked (Renewed Premium)",366.67,4.3,,4.3
Smartphones,Motorola Moto G Stylus 5G | 2023 | Unlocked | Made for US 6/256GB | 50 MPCamera | Rose Champagne,299.99,4.4,,4.4
Smartphones,Motorola Moto G Stylus 5G | 2023 | Unlocked | Made for US 6/256GB | 50 MPCamera | Rose Champagne,299.99,4.4,,4.4
Smartphones,"Apple iPhone 12, 64GB, Red - Unlocked (Renewed Premium)",449.99,4.2,,4.2
Smartphones,"Apple iPhone 12, 64GB, Red - Unlocked (Renewed Premium)",449.99,4.2,,4.2
Smartphones,"Xiaomi Redmi Note 11 - Smartphone 128GB, 4GB RAM, Dual Sim, Star Blue",159.99,4.4,,4.4
Smartphones,"Xiaomi Redmi Note 11 - Smartphone 128GB, 4GB RAM, Dual Sim, Star Blue",159.99,4.4,,4.4
Smartphones,"Ulefone Rugged Cell Phones 2023, Armor X13 Unlocked Smartphone, 50MP+24MP+8MP Cameras, 12+64GB Storage, 6.52” Screen, 6320mAh, Android 13, NFC,GPS,Dual 4G Volte T-Mobile Rugged Phones(Orange)",169.99,5.0,,5.0
Smartphones,"Ulefone Rugged Cell Phones 2023, Armor X13 Unlocked Smartphone, 50MP+24MP+8MP Cameras, 12+64GB Storage, 6.52” Screen, 6320mAh, Android 13, NFC,GPS,Dual 4G Volte T-Mobile Rugged Phones(Orange)",169.99,5.0,,5.0
Smartphones,"TracFone Moto g Pure (2021), 32GB, Blue - Prepaid Smartphone (Locked/Renewed)",24.99,4.2,,4.2
Smartphones,"TracFone Moto g Pure (2021), 32GB, Blue - Prepaid Smartphone (Locked/Renewed)",24.99,4.2,,4.2
Smartphones,"CUBOT Pocket 4 inch Smartphone Without Contract, Android 11 Mobile Phone, 4GB + 64GB, 128 GB Expandable, 3000mAh Battery, 16MP + 5MP Camera, 4G Dual SIM NFC, GPS, Face ID，Black",149.99,3.9,,3.9
Smartphones,"CUBOT Pocket 4 inch Smartphone Without Contract, Android 11 Mobile Phone, 4GB + 64GB, 128 GB Expandable, 3000mAh Battery, 16MP + 5MP Camera, 4G Dual SIM NFC, GPS, Face ID，Black",149.99,3.9,,3.9
Smartphones,"CUBOT Pocket 4 inch Smartphone Without Contract, Android 11 Mobile Phone, 4GB + 64GB, 128 GB Expandable, 3000mAh Battery, 16MP + 5MP Camera, 4G Dual SIM NFC, GPS, Face ID，Black",149.99,3.9,,3.9
Smartphones,OnePlus 10 Pro | 5G Android Smartphone | 8GB+128GB | U.S. Unlocked | Triple Camera co-Developed with Hasselblad | Volcanic Black,463.63,4.3,,4.3
Smartphones,OnePlus 10 Pro | 5G Android Smartphone | 8GB+128GB | U.S. Unlocked | Triple Camera co-Developed with Hasselblad | Volcanic Black,463.63,4.3,,4.3
Smartphones,Google Pixel 7a - Unlocked Android Cell Phone - Smartphone with Wide Angle Lens and 24-Hour Battery - 128 GB -  Sea,444.00,4.2,,4.2
Smartphones,Google Pixel 7a - Unlocked Android Cell Phone - Smartphone with Wide Angle Lens and 24-Hour Battery - 128 GB -  Sea,444.00,4.2,,4.2
Smartphones,NIEGA Smartphone Unlocked Cell Phones S23 Ultra 6.82in HD Screen The Black Phone 3GB/32GB 6800mAh 128GB Extension Dual Sim Boost Mobile Phones Telefonos Glass Back Cover (Pink),99.99,5.0,,5.0
Smartphones,NIEGA Smartphone Unlocked Cell Phones S23 Ultra 6.82in HD Screen The Black Phone 3GB/32GB 6800mAh 128GB Extension Dual Sim Boost Mobile Phones Telefonos Glass Back Cover (Pink),99.99,5.0,,5.0
Smartphones,Motorola Edge | 2021 | 2-Day battery | Unlocked | Made for US | 8/256GB | 108MP Camera | Nebula Blue,324.99,4.2,,4.2
Smartphones,Motorola Edge | 2021 | 2-Day battery | Unlocked | Made for US | 8/256GB | 108MP Camera | Nebula Blue,324.99,4.2,,4.2
Smartphones,"ONEPLUS Nord N20 5G | Android Smart Phone | 6.43"" AMOLED Display| 6+128GB | U.S. Unlocked | 4500 mAh Battery | 33W Fast Charging | Blue Smoke",208.22,4.2,,4.2
Smartphones,"ONEPLUS Nord N20 5G | Android Smart Phone | 6.43"" AMOLED Display| 6+128GB | U.S. Unlocked | 4500 mAh Battery | 33W Fast Charging | Blue Smoke",208.22,4.2,,4.2
Smartphones,"Motorola Moto G 5G | 2023 | Unlocked | Made for US 4/128GB | 48 MPCamera | Harbor Gray, 163.94x74.98x8.39",199.99,4.3,,4.3
Smartphones,"Motorola Moto G 5G | 2023 | Unlocked | Made for US 4/128GB | 48 MPCamera | Harbor Gray, 163.94x74.98x8.39",199.99,4.3,,4.3
Smartphones,"Total by Verizon BLU View 2, 32GB, Black - Prepaid Smartphone (Locked)",29.99,4.0,,4.0
Smartphones,"Total by Verizon BLU View 2, 32GB, Black - Prepaid Smartphone (Locked)",29.99,4.0,,4.0
Smartphones,"OnePlus Nord N200 | Large 5000mAh Battery | 5G Unlocked Android Smartphone U.S Version | 64GB Storage | 6.49"" Full HD+LCD Screen | 90Hz Smooth Display | Fast Charging | Triple Camera,Blue Quantum",169.99,4.1,,4.1
Smartphones,"OnePlus Nord N200 | Large 5000mAh Battery | 5G Unlocked Android Smartphone U.S Version | 64GB Storage | 6.49"" Full HD+LCD Screen | 90Hz Smooth Display | Fast Charging | Triple Camera,Blue Quantum",169.99,4.1,,4.1
Smartphones,"Xgody X18 4G Unlocked Phones, 6.3 Inch IPS Screen Smartphones, Android 10 OS Dual SIM Cheap Cell Phone, Quad Core 2GB+16GB, Dual 5MP+8MP Camera, 4000mAh Battery, Face ID Smart Phone (Purple)",69.99,3.8,,3.8
Smartphones,"Xgody X18 4G Unlocked Phones, 6.3 Inch IPS Screen Smartphones, Android 10 OS Dual SIM Cheap Cell Phone, Quad Core 2GB+16GB, Dual 5MP+8MP Camera, 4000mAh Battery, Face ID Smart Phone (Purple)",69.99,3.8,,3.8
Smartphones,"FOLOSAFENAR Smartphone,5.45in HD Full Screen Dual Card Dual Standby Mobile Phone,Face Recognition and Fingerprint Unlocking,Light and Fashion",56.59,2.4,,2.4
Smartphones,"FOLOSAFENAR Smartphone,5.45in HD Full Screen Dual Card Dual Standby Mobile Phone,Face Recognition and Fingerprint Unlocking,Light and Fashion",56.59,2.4,,2.4
Smartphones,Samsung Galaxy S20+ 5G 128GB Fully Unlocked Smartphone (Renewed),260.08,4.3,,4.3
Smartphones,Samsung Galaxy S20+ 5G 128GB Fully Unlocked Smartphone (Renewed),260.08,4.3,,4.3
Smartphones,"Apple iPhone 12 Pro, 128GB, Silver - Unlocked (Renewed Premium)",620.00,4.2,,4.2
Smartphones,"Apple iPhone 12 Pro, 128GB, Silver - Unlocked (Renewed Premium)",620.00,4.2,,4.2
Smartphones,"ExAchat C22 Cell Phone Unlocked 5G/4G, 6GB+256GB Android 13 Phone 7.3” FHD+ Display120Hz Smartphone,7300mAh 64MP Camera Dual SIM Phone with Pen/Headset/GPS/Face ID",149.99,1.0,,Price
Smartphones,"ExAchat C22 Cell Phone Unlocked 5G/4G, 6GB+256GB Android 13 Phone 7.3” FHD+ Display120Hz Smartphone,7300mAh 64MP Camera Dual SIM Phone with Pen/Headset/GPS/Face ID",149.99,1.0,,1.0
Smartphones,"ExAchat C22 Cell Phone Unlocked 5G/4G, 6GB+256GB Android 13 Phone 7.3” FHD+ Display120Hz Smartphone,7300mAh 64MP Camera Dual SIM Phone with Pen/Headset/GPS/Face ID",149.99,1.0,,1.0
Smartphones,Nokia C01 Plus | Android 11 (Go Edition) | Unlocked Smartphone | 2-Day Battery | 1/32GB | 6.52-Inch Screen | Dark Blue,77.80,3.6,,3.6
Smartphones,Nokia C01 Plus | Android 11 (Go Edition) | Unlocked Smartphone | 2-Day Battery | 1/32GB | 6.52-Inch Screen | Dark Blue,77.80,3.6,,3.6
Smartphones,"Xiaomi Redmi 9C Smartphone 128GB + 4GB 6.53""HD + Dot Drop Display 5000mAh, Face Recognition AI, 13 MP, Triple Camera (NOT for Verizon Boost Cricket) + (w/Fast Car Charger Bundle) (Midnight Gray)",109.99,4.5,,4.5
Smartphones,"Xiaomi Redmi 9C Smartphone 128GB + 4GB 6.53""HD + Dot Drop Display 5000mAh, Face Recognition AI, 13 MP, Triple Camera (NOT for Verizon Boost Cricket) + (w/Fast Car Charger Bundle) (Midnight Gray)",109.99,4.5,,4.5
video_games,PlayStation 5 Console (PS5),489.99,4.8,,4.8
video_games,Xbox Series X,489.99,4.8,,4.8
video_games,Xbox Series X,489.99,4.8,,4.8
video_games,Meta Quest 2 — Advanced All-In-One Virtual Reality Headset — 128 GB,299.00,4.7,,4.7
video_games,Meta Quest 2 — Advanced All-In-One Virtual Reality Headset — 128 GB,299.00,4.7,,4.7
video_games,Nintendo Switch™ with Neon Blue and Neon Red Joy‑Con™,295.90,4.8,,4.8
video_games,Nintendo Switch™ with Neon Blue and Neon Red Joy‑Con™,295.90,4.8,,4.8
video_games,PlayStation DualSense Wireless Controller – Midnight Black,69.00,4.8,,4.8
video_games,PlayStation DualSense Wireless Controller – Midnight Black,69.00,4.8,,4.8
video_games,Mortal Kombat 1 Premium Edition – PlayStation5,109.99,5.0,,5.0
video_games,Mortal Kombat 1 Premium Edition – PlayStation5,109.99,5.0,,5.0
video_games,Nintendo Switch – OLED Model w/ White Joy-Con,319.99,4.8,,4.8
video_games,Nintendo Switch – OLED Model w/ White Joy-Con,319.99,4.8,,4.8
video_games,"Xbox Wireless Headset – Xbox Series X|S, Xbox One, and Windows Devices",79.48,4.6,,4.6
video_games,"Xbox Wireless Headset – Xbox Series X|S, Xbox One, and Windows Devices",79.48,4.6,,4.6
video_games,Madden NFL 24 - PlayStation 5,69.00,4.0,,4.0
video_games,Madden NFL 24 - PlayStation 5,69.00,4.0,,4.0
video_games,The Legend of Zelda: Tears of the Kingdom - Nintendo Switch (US Version),59.50,4.9,,ESRB
video_games,The Legend of Zelda: Tears of the Kingdom - Nintendo Switch (US Version),59.50,4.9,,ESRB
video_games,The Legend of Zelda: Tears of the Kingdom - Nintendo Switch (US Version),59.50,4.9,,ESRB
video_games,"Microsoft Xbox Series S 512GB Game All-Digital Console + 1 Xbox Wireless1 Controller, White - 1440p Gaming Resolution, 4K Streaming Media Playback, WiFi (Renewed)",269.00,4.5,,4.5
video_games,"Microsoft Xbox Series S 512GB Game All-Digital Console + 1 Xbox Wireless1 Controller, White - 1440p Gaming Resolution, 4K Streaming Media Playback, WiFi (Renewed)",269.00,4.5,,4.5
video_games,Mario Kart 8 Deluxe - US Version,48.12,4.9,,ESRB
video_games,Mario Kart 8 Deluxe - US Version,48.12,4.9,,ESRB
video_games,WD_BLACK 1TB C50 Storage Expansion Card for Xbox Series X|S - Quick Resume - Plug & Play - WDBMPH0010BNC-WCSN,149.99,4.7,,4.7
video_games,WD_BLACK 1TB C50 Storage Expansion Card for Xbox Series X|S - Quick Resume - Plug & Play - WDBMPH0010BNC-WCSN,149.99,4.7,,4.7
video_games,NBA 2K24 Black Mamba Edition - PlayStation 5,99.99,1.6,,1.6
video_games,NBA 2K24 Black Mamba Edition - PlayStation 5,99.99,1.6,,1.6
video_games,Starfield: Standard Edition - Xbox Series X,69.89,3.9,,ESRB
video_games,Starfield: Standard Edition - Xbox Series X,69.89,3.9,,ESRB
video_games,Meta Quest 2 - Advanced All-In-One Virtual Reality Headset - 128 GB (Renewed Premium),269.99,4.6,,4.6
video_games,Meta Quest 2 - Advanced All-In-One Virtual Reality Headset - 128 GB (Renewed Premium),269.99,4.6,,4.6
video_games,Nintendo Switch Lite - Blue,184.75,4.8,,4.8
video_games,Nintendo Switch Lite - Blue,184.75,4.8,,4.8
video_games,Super Smash Bros. Ultimate - US Version,49.70,4.8,,ESRB
video_games,Super Smash Bros. Ultimate - US Version,49.70,4.8,,ESRB
video_games,"HyperX Cloud II - Gaming Headset, 7.1 Surround Sound, Memory Foam Ear Pads, Durable Aluminum Frame, Detachable Microphone, Works with PC, PS5, PS4, Xbox Series X|S, Xbox One – Red",62.98,4.5,,4.5
video_games,"HyperX Cloud II - Gaming Headset, 7.1 Surround Sound, Memory Foam Ear Pads, Durable Aluminum Frame, Detachable Microphone, Works with PC, PS5, PS4, Xbox Series X|S, Xbox One – Red",62.98,4.5,,4.5
video_games,"BENGOO G9000 Stereo Gaming Headset for PS4 PC Xbox One PS5 Controller, Noise Cancelling Over Ear Headphones with Mic, LED Light, Bass Surround, Soft Memory Earmuffs for Laptop Mac Nintendo NES Games",21.99,4.3,,4.3
video_games,"BENGOO G9000 Stereo Gaming Headset for PS4 PC Xbox One PS5 Controller, Noise Cancelling Over Ear Headphones with Mic, LED Light, Bass Surround, Soft Memory Earmuffs for Laptop Mac Nintendo NES Games",21.99,4.3,,4.3
video_games,Sony Official Playstation 5 Dualsense Wireless Controller - Midnight Black (PS5) (PS5),69.00,4.8,,4.8
video_games,Sony Official Playstation 5 Dualsense Wireless Controller - Midnight Black (PS5) (PS5),69.00,4.8,,4.8
video_games,"SteelSeries Arctis Nova Pro Wireless Multi-System Gaming Headset - Premium Hi-Fi Drivers - Active Noise Cancellation - Infinity Power System - Stealth Retractable Mic - PC, PS5/PS4, Switch, Mobile",349.00,4.3,,4.3
video_games,"SteelSeries Arctis Nova Pro Wireless Multi-System Gaming Headset - Premium Hi-Fi Drivers - Active Noise Cancellation - Infinity Power System - Stealth Retractable Mic - PC, PS5/PS4, Switch, Mobile",349.00,4.3,,4.3
video_games,"SteelSeries Arctis Nova Pro Wireless Multi-System Gaming Headset - Premium Hi-Fi Drivers - Active Noise Cancellation - Infinity Power System - Stealth Retractable Mic - PC, PS5/PS4, Switch, Mobile",349.00,4.3,,4.3
video_games,Armored Core VI Fires of Rubicon - PlayStation 5,59.99,4.3,,ESRB
video_games,Armored Core VI Fires of Rubicon - PlayStation 5,59.99,4.3,,ESRB
video_games,"Logitech G PRO X SUPERLIGHT Wireless Gaming Mouse, Ultra-Lightweight, HERO 25K Sensor, 25,600 DPI, 5 Programmable Buttons, Long Battery Life, Compatible with PC / Mac - Black",110.00,4.7,,4.7
video_games,"Logitech G PRO X SUPERLIGHT Wireless Gaming Mouse, Ultra-Lightweight, HERO 25K Sensor, 25,600 DPI, 5 Programmable Buttons, Long Battery Life, Compatible with PC / Mac - Black",110.00,4.7,,4.7
video_games,"GameSir G7 SE Wired Controller for Xbox Series X|S, Xbox One & Windows 10/11, Plug and Play Gaming Gamepad with Hall Effect Joysticks/Hall Trigger, 3.5mm Audio Jack",44.99,4.4,,4.4
